,0,1,2,3,4,5
1038,7.1,Farhan Akhtar,Salim Khan,"Vijay is recruited by a police officer to masquerade as his lookalike Don, the leader of an international gang of smugglers. Things go wrong when the officer is killed and Vijay is left to fend for himself.",178,Don
1039,5.8,Jérôme Cornuau,Xavier Dorison,"The film, set in 1912, is about the exploits of France's first motorized police brigade.",125,Las brigadas del Tigre
1040,3.1,David Chameides,"Caitlin Mc, Kenna, G. Anthony Joseph, Cauri Jaye","CIA Agent Skye Gold races through the throngs of Caribbean Carnival pursued by a mystery avenger, in a heart-pumping action thriller.",87,Backlash
1041,4.5,Michael Hjorth,"Giuseppe Cristiano, Michael Hjorth, Michael Hjorth",Two Brothers arguing about the money left by their parents,94,7 miljonärer
1042,4.3,Jason Stephenson,"Robbie Ribspreader, Jason Stephenson","A small Mid-western town is thrust into chaos after an airborne virus swiftly turns most of the locals into raving mad zombies with an insatiable hunger for the living! Caught amidst the epidemic is an eclectic group of survivors who've been hiding out in a ram- shackled farmhouse. Now running low on food, water and vital ammunition to keep the growing number of livin... Leer todo",78,Doomed to Consume
1043,3.5,Ajay Kanchan,"Rati Agnihotri, Aryan Vaid, Megha Chatterji","Raj, a basketball champion, indulges in casual relationships with a number of women. Finally, when he decides to marry his girlfriend, Tanvi, Raj discovers that he is HIV positive.",No tiene datos,Aisa Kyon Hota Hai?
1044,7.0,Michel Hazanavicius,Jean-François Halin,"El agente secreto OSS 117 frustra los planes de los nazis, se acuesta con bellezas locales y trae la paz al Medio Oriente.",99,"OSS 117: El Cairo, nido de espías"
1045,6.4,Xiaogang Feng,"Gangjian Qiu, William Shakespeare, Heyu Sheng","A loose adaptation of Hamlet, ""The Night Banquet"" is set in an empire in chaos. The Emperor, the Empress, the Crown Prince, the Minister and the General all have their own enemies they would like to finish off at a night banquet.",131,The Banquet
1046,6.1,M.J. Bassett,Dario Poloni,"Juvenile delinquents are sent to a small British island after a fellow prisoner's death, where they have to fight for survival.",93,Cacería
1047,6.0,Justin Lin,Chris Morgan,Un adolescente se convierte en un gran competidor en el mundo de las carreras a la deriva después de mudarse con su padre en Tokio para evitar una sentencia de cárcel en Estados Unidos.,104,A todo gas: Tokyo Race
1048,4.9,Jay Craven,Jay Craven,"Forced to smuggle whiskey in an attempt to save a family, Quebec Bill (Kris Kristofferson) and his son embark on an unforgettable trip through the vast reaches of the wilderness.",118,La frontera del contrabando
1049,6.8,Jasmin Durakovic,Jasmin Durakovic,"Sarajevo, 1992. They are called Ahmed, Lana, Sado, Saba, Sahbey, Beba, Nemanja, Marx, Matan. They live in and between wartimes. They have ""nafaka"", the destiny which was bestowed on them by God Almighty. They have enough gallows humor and courage to believe in freedom and happiness.",115,Nafaka
1050,4.4,Tomy Wigand,"Marco Petry, Rolf Kalmuczak, Burt Weinshanker",Four teenage sleuths solve a case regarding abducted children and teenagers and a mind machine.,117,TKKG und die rätselhafte Mind-Machine
1051,4.5,Dharani,"Dharani, Siva Akula","In order to join an international news channel, a fired reporter tries to obtain his boss's signature on a character certificate but is forced by circumstances to help the latter's daughter elope from her wedding.",178,Bangaram
1052,2.2,Preston A. Whitmore II,Preston A. Whitmore II,The lives of a gifted athlete and his best friend change when they take a fateful trip to Los Angeles. The young hopefuls must use every skill at their command to topple the reigning street ball champions from their thrones.,95,Crossover
1053,4.3,Damian Chapa,"Damian Chapa, Carlton Holder",A disgruntled I.R.A. member (Chapa) becomes Ireland's biggest threat to the peace process.,85,I.R.A.: King of Nothing
1054,4.7,Rafael Edholm,"Rafael Edholm, Björn Olofsson",Jojo is out of money and must work for his stepfather's shady car dealership to pick up a car that belongs to a Russian gangster.,90,Babas bilar
1055,5.8,Prabhu Deva,"M.S. Raju, Paruchuri Venkateswara Rao, Gopalakrishna Paruchuri","A young woman, who has trained for a ceremonial dance, unexpectedly disappears. A stranger with a secret past arrives in town and offers to teach the dance to the woman's younger sister.",160,Pournami
1056,7.8,Mel Gibson,Mel Gibson,"Mientras el reino maya se enfrenta a su declive, un joven es llevado en un peligroso viaje a un mundo gobernado por el miedo y la opresión.",139,Apocalypto
1057,5.3,Ernest Dancy,Ernest Dancy,"Knuckle game is a movie that chronicles the lives of two men, Terry and Preme. It shows how these two people, both from different parts of town became well known as the two best fighters in their respective hoods. It depicts how lies, deceit and trickery lead them into this under ground fighting tournament that takes place in the inner city of New York. As if it were ... Leer todo",95,Knuckle Game
1058,6.6,Joe Carnahan,Joe Carnahan,"Buddy Israel, informador en Las Vegas, testifica contra una organización que a consecuencia querrá matarle.",109,Ases calientes
1059,4.9,Hugh Hannah,Eli Harris,"In Westlyn City, Treyman Lewis is a thriving Realtor who is haunted by his past in nightmares. Vonda Lewis, his wife, who is a high powered attorney attempts to help him cope with his dreams, but is unsuccessful. Meanwhile, the city is ran by a corrupt business man and politician, John Grazier, who is becoming uneasy. Lately there is a new string of murders, rumor has... Leer todo",80,Saga Tier I
1060,7.6,Paul Greengrass,Paul Greengrass,"Un relato en tiempo real de los eventos del vuelo 93 de United, uno de los aviones secuestrados el 11 de septiembre de 2001 que se estrelló cerca de Shanksville, Pensilvania cuando los pasajeros frustraron el complot terrorista.",111,United 93
1061,7.0,Yimou Zhang,Zhihong Bian,"Durante la dinastía Tang de China, el emperador toma como esposa a la princesa de una provincia vecina. Ella le da dos hijos y cría a su hijo mayor. Ahora el control sobre su dominio es completo, incluyendo la propia familia real.",114,La maldición de la flor dorada
1062,4.4,Gaspar Hernandez III,Gaspar Hernandez III,"A weekend of darkness entraps a small group of lowlifes held up at a secluded bordello, as their leader transgresses slowly into total insanity...",113,Inner Rage
1063,4.8,Filipp Yankovskiy,"Yevgeni Danilenko, Konstantin Syngayevsky","A young boy's dreams of glory and war turn into a bitter nightmare as his father's kingdom is overrun by an invading army. Lost and alone in the woods, he finds an ancient sword that promises him the ability to claim his vengeance.",108,Mechenosets
1064,3.2,Deepak Tijori,"Kamal Pandey, Yunus Sajawal, Ali Shah","Three disabled friends - deaf Tom, blind Dick and dumb Harry - get caught up in a whirlwind adventure involving two beautiful girls, a kidnapping and a ton of cash.",137,"Tom, Dick, and Harry"
1065,5.2,Renny Harlin,J.S. Cardone,"Cuatro jóvenes de una familia supernatural de Nueva Inglaterra luchan contra el quinto poder que creían haber derrocado, pero los celos y las sospechas amenazan con separarlos.",97,La alianza del mal
1066,4.9,Anton Sivers,Arkadiy Tigay,"Li has nothing, she does not even have a name. They love each other madly, but they belong to system.",105,Potseluy babochki
1067,6.0,Andrey Kavun,"Aleksandr Bushkov, Dmitriy Zverkov","Agent of special department ""Piranha"" Kirill Mazur and his colleague Olga go to the far north with the assignment to liquidate an underwater secret weapon lab in the guise of a mutual vacation. All of a sudden, they find themselves in the world where civilization laws are forgotten, and this deadly weapons are kept by gangsters who are controlled by a new ""master of t... Leer todo",167,Okhota na Piranyu
1068,No tiene datos,Kazuhiro Kunishi,Kazuhiro KunishiGou Suzuki,No tiene datos,91,Pink_D
1069,3.8,Raman Kumar,"Robin Bhatt, Akarsh Khurana, Akash Khurana",An Indian soldier tries to exact revenge on those who had wronged him is backed by the emotional support of two women.,117,Sarhad Paar
1070,6.9,Asger Leth,Asger Leth,"Documents the violent lives of gang leaders in Haiti's worst slum, focusing on two brothers loyal to then-President Aristide.",85,Fantasmas de Cité Soleil
1071,4.2,Franklin Guerrero Jr.,"Eric Williford, Franklin Guerrero Jr.J. Michael Whalen","The 8th Plague is the story of a woman named Launa who is investigating the disappearance of her sister, Nikki. Nikki had gone camping in the mountain town of Halcyon Springs and never came back. Becoming more and more frustrated, Launa realizes that she must find her sister on her own with the help of Mason, a mysterious local man with a shadowed past. Their search l... Leer todo",90,The 8th Plague
1072,7.1,Sylvester Stallone,Sylvester Stallone,"Treinta años después de que la primera campana sonara, Rocky Balboa abandona su jubilación y toma sus guantes de boxeo una última vez para luchar contra el campeón Mason Dixon.",102,Rocky Balboa
1073,4.8,Sam Akina,Sam Akina,"A hard boiled tale of bloody revenge that interweaves the stories of nine criminals. Hector Gonzales, a ruthless kingpin who has risen through the ranks over the last ten years and now stands on the verge of ruling the city; Bill Nguyen, a Vietnamese mafia boss; Abe Shanks, a black market organ dealer; Johnny Tran, a young Dai Ca within Nguyen's Viet mafia; Tommy Two ... Leer todo",115,"Bullets, Blood & a Fistful of Ca$h"
1074,6.9,Mark Neveldine,Mark Neveldine,El asesino profesional Chev Chelios se entera de que su enemigo le ha inyectado un veneno que lo matará si su ritmo cardíaco disminuye.,88,Crank: Veneno en la sangre
1075,No tiene datos,No tiene datos,No tiene datos,No tiene datos,No tiene datos,No tiene datos
1076,6.7,Erik Canuel,"Leila Basen, Alex Epstein, Patrick Huard","Dos detectives canadienses, uno de Ontario y otro de Quebec, deben trabajar juntos cuando hallan a una víctima de asesinato en la frontera entre Ontario y Quebec.",117,Dos polis en apuros
1077,6.6,David Von Ancken,David Von Ancken,"Tras el final de la guerra de Secesión, un antiguo coronel confederado persigue a un antiguo oficial yanqui con el que guarda rencor.",115,Enfrentados
1078,6.1,Alister Grierson,Alister Grierson,A bitter battle is fought between Australian and Japanese soldiers along the Kokoda trail in New Guinea during World War II.,92,Kokoda: batallón 39
1079,2.7,Martin Holland,Martin Holland,"Stel, a humanoid alien, teams up with a British soldier Private John Marrettie. They engage on an action-packed adventure to find a top-secret file, which holds information on advanced energy production, captured space crafts, and their alien pilots, including Stel's missing father, Arakawa, who's been shot down and imprisoned on Earth by Core, a human paramilitary gr... Leer todo",99,Displaced
1080,5.9,Hans Herbots,Pierre De Clercq,"After an over-cocky inter-forces 'anti-terrorism' game in which he damaged the minister's car, Belgian Army special ops diver Rick Symons is transferred to the Navy. Alas, in Koksijde base's rescue unit, rivalry among both Seaking helicopter crews is as dangerously blind. Rick has a stormy hate-love-relationship with female medic Alex Breynaert. And his past, an incid... Leer todo",117,Windkracht 10: Koksijde Rescue
1081,6.1,Wilson Yip,"Yuk Long Wong, Edmond Wong",Three young martial arts masters emerge from the back streets of Hong Kong to help the powerless fight injustice.,94,Dragon Tiger Gate
1082,5.3,Vijay Milton,"Cheran, Vijay Milton","Mano loves Jo but when he realises that Jo is in love with Prem, he decides to help her in winning Prem's love. They succeed in their plan to separate Prem from his girlfriend Nandini.",157,Azhagai Irukirai... Bayamai Irukiradhu
1083,5.4,Surender Reddy,"Vakkantham Vamsi, Marudhuri Raja, Surender Reddy","A quick-tempered auto-mechanic is desperate to reconcile with his pacifist father; but a threat from a blood-thirsty mobster forces him to fight for the sake of his family, friends, and love.",No tiene datos,Ashok
1084,6.1,Nobuyuki Takahashi,Kazuma Toyoda,Three high school students decide to challenge the legendary surf at Shonan Beach.,116,Catch a Wave
1085,7.2,Wolf Wolff,"Andrea Baumhoff, Thorsten Nesch, Wolf Wolff",No tiene argumento,95,Ludgers Fall
1086,2.0,Rodolfo Ledo,"Salvador Valverde Freire, Salvador Valverde Calvo",Three friends at a beach resort work together to stop a gang from making a potion that can manipulate people's desires.,92,"Bañeros III, todopoderosos"
1087,6.3,Kim Seong-soo,Han Ji-hoon,Hot-blooded district attorney Jin-woo and undisciplined cop Do-young want the same thing; justice. Their methods are completely different but they team up to catch and prosecute a powerful mafia boss and politician YOO.,124,Ya-soo
1088,3.8,Steven R. Monroe,Michael Worth,"A lonely tow-truck driver gets caught in a deadly struggle between a pair of bank robbers with a beautiful hostage, local cops, and a monster that has come down from the Arizona mountains to eat human flesh.",90,Enfrentados a la bestia
1089,3.2,Gil Medina,"Jeff Hawker, Gil Medina","An undercover cop, accused of a crime he did not commit, regains his freedom and decides to take revenge.",90,Jack's Law
1090,6.6,Benny Chan,Jackie Chan,"Thongs and Octopus accept a job from their landlord: kidnap a baby. Soon, the baby awakens strong paternal feelings in the two crooks, leading to complications when it comes to handing him over to his possibly crazy gang boss grandfather.",136,2 ladrones y medio
1091,7.2,Major Ravi,Major Ravi,Based on a real life incident that happened during the Kargil War.,130,Keerthi Chakra
1092,3.1,I.V. Sasi,"T. Damodaran, Mohan Nair, S.N. Swamy","Mammootty plays a duel role of a police inspector Balram and a smuggler Taradas, both are enemies. They fight until they both have a common enemy.",161,Balram vs. Tharadas
1093,6.8,Sang H. Kim,Sang H. Kim,A peace-seeking Zen master is drawn into a web of revenge by the son of his former student.,87,Zen Man
1094,6.7,Chi Leung 'Jacob' Cheung,"Chi Leung 'Jacob' Cheung, Ken'ichi Sakemi, Sentaro Kubota","La historia se centra en una batalla durante el Período de los Reinos Combatientes de China, una serie de guerras civiles, que se extendió desde el siglo V al III a.C.",133,Mo gong
1095,3.6,Brian Trenchard-Smith,Paula Goldberg,"Cuando el avión del vicepresidente se estrella en una remota isla del Pacífico, fuerzas rebeldes lo secuestran y retienen para pedir un rescate. Depende de un agente del Servicio Secreto y de una secretaria de prensa rescatarlo.",88,Atrapados en la isla
1096,3.0,María Lidón,Adela Ibañez,"En Moscú, el sacerdote Owen contrata un equipo para guiarlo en el inframundo para encontrar a su amigo Sergei que esta desaparecido mientras investiga la leyenda sobre la existencia de demonios y una entrada al infierno bajo la ciudad.",82,Moscow Zero
1097,6.5,David Gleeson,David Gleeson,"An African immigrant bank security guard turns the tables on Dublin's nastiest criminals when they force him to be the ""inside man"" on a bank robbery",93,The Front Line
1098,4.9,Sanjay Gupta,"Vishal Dadlani, Sanjay Gupta, Anwar Maqsood","A man, taken and locked up for 14 years without any sane reason, is suddenly released, and has 4 days to figure out why this was done to him.",116,Zinda
1099,5.6,Iván Kapitány,"Gábor Olivér Buss, Zoltán Gergely, Iván Kapitány","Tamás is taken hostage during a gas station robbery. Quite an eccentric company comes together and no one is who they say they are, while the Football World Cup sometimes interferes and an unknown container also appears.",105,Kútfejek
1100,8.0,Vishal Bhardwaj,Vishal Bhardwaj,La desconfianza de teniente lo lleva a sospechar que su esposa le es infiel.,155,Omkara
1101,6.8,Kô Matsuo,"Hajime Yatate, Yoshiyuki Tomino","In the trilogy's final saga, alliances are made and broken as the AEUG, Titans and Axis initiate an all-out war for control of the Earth Sphere.",99,Kidô senshi Z Gandamu III: Hoshi no kodô wa ai
1102,5.2,Lance W. Dreesen,Lance W. Dreesen,"After being attacked by a werewolf, a teenager believing it may have been his stepfather attempts to expose him.",95,Alaridos
1103,3.0,S. Janardhanan,S. Janardhanan,"Isahak, a fisherman and football player, falls in love with Devi. But their married life is shattered when Devi gets arrested for murder on their wedding night.",No tiene datos,Mahasamudram
1104,7.1,A. Karunakaran,"A. Karunakaran, Radha Mohan, Darling Swamy",An orphan working as a Pizza delivery boy and the daughter of a caste-based politician are forced to get married in an unforeseen situation.,152,Happy
1105,4.7,Jeff Burr,Mitch Gould,"Two small time drug-dealers cross paths with a female-assassin, a monster hunter, a Japanese swordsman and even the Devil himself at a gentlemen's club housing murderous she-demons.",84,Devil's Den
1106,5.1,Takashi Miike,Hisao Maki,A member of the Yakuza is imprisoned for violent behaviour including fighting another group of thugs. There he meets another man and the two become friends. Once released the friend is back into illicit activities and begins making money off the eastern mafia prompting that group's head to put a price on his head that leads to his death. The Yakuza member seeks to ave... Leer todo,84,Waru
1107,5.1,K.S. Ravikumar,Uttaranshy Pareek,"Saravana (Silambarasan) and Krishna (Krishna) are close buddies in college. Saravana sees a video tape of Krishna's sister Sadhana (Jyothika) studying in London and falls in love with her. So to meet her, Saravana goes with Krishna to a village near Tirunelveli where he finds that there is a bloody war going on between two warring caste groups. Krishna's brother Sound... Leer todo",167,Saravana
1108,7.5,Rohit Shetty,Neeraj Vora,Four runaway crooks take shelter in a bungalow which is owned by a blind couple.,150,Golmaal: Fun Unlimited
1109,7.2,Anurag Basu,Mahesh Bhatt,"Simran, who relocates to Seoul, is distraught when Daya, a gangster, re-enters her life. She has to make a choice between him and her lover Akash, who is a singer at an Indian restaurant.",123,Gangster
1110,5.2,Frank van Geloven,"Frank van Geloven, Edwin Visser","After her father gets killed in an automobile accident, Kristel Lodema discovers that he was investigating an old mine where convicted child killer Andries Martiens died back in 1857. Kristel decides to check out the mine along with a group of young adults. However, the mine turns out to be haunted by the dangerous, murderous spirit of Martiens.",90,Sl8n8
1111,5.7,Serdar Akar,"Raci Sasmaz, Bahadir Özdener","The film covers through fiction real-life events like the occupation of Iraq, the execution of Daniel Pearl, the Hood event and the Abu Ghraib torture scandal.",122,"Iraq, el valle de los lobos"
1112,7.0,Jeff Tremaine,Jeff Tremaine,Prepárate para sufrir ataques de risa incontrolables y oleadas de náusea mientras estos chicos castigan sus maltratados cuerpos con un bombardeo de situaciones absurdas.,92,Jackass dos: todavía más
1113,4.9,Srinivasa Rao Bhimaneni,"Srinivasa Rao Bhimaneni, Perarasu, Abburi Ravi",This is the story of a brother who wanted to give his sister the best of everything.. a pure sentiment story on family.,175,Annavaram
1114,8.0,Ronnie Ricketts,"Lito Mena, Ronnie Ricketts","Revolves around the life of two siblings who grew up in different worlds: Alex a taxi driver who moonlights as an underground street fighter and Sarah a United States bred teenager who just got back in the Philippines with their mother. Through Boogie, an aspiring rapper, he met Sarah and their mother without knowing they were the family he has searched long and hard ... Leer todo",107,Lagot ka sa kuya ko
1115,8.3,LaFaye Baker,"La, Faye Baker","The 60-minute docudrama, Hollywood At Its Best highlights the personal and professional lives of five of Hollywood's top five African-American stuntwomen, La Faye Baker, Kelsee Devoureaux, April Weeden-Washington, Sharon Schaffer, and Kim Washington.",60,Hollywood at Its Best
1116,2.8,Gerald Nott,Gerald Nott,"Eighty-two years ago a viral outbreak turned three quarters of the world population into the walking dead. Now, Bounty Hunters are humanity's only salvation.",80,The Quick and the Undead
1117,5.8,Stefan Faldbakken,"Harald Rosenløw-Eeg, Stefan Faldbakken","Turning his back on a delinquent past and joining the police force, HP is determined to start doing the right thing. Soon he finds himself trapped in a web of lies, stretching out from both sides of the law. HP soon realizes that his present mission is closely connected to his own past, and that everything he worked so hard to escape from, is coming back to haunt him.",104,Uro: las dos caras de la ley
1118,7.8,Clint Eastwood,Iris Yamashita,"La historia de la batalla de Iwo Jima entre los Estados Unidos y el Japón imperial durante la Segunda Guerra Mundial, contada desde la perspectiva de los japoneses que lucharon en ella.",141,Cartas desde Iwo Jima
1119,4.2,Jamie Nash,Jamie Nash,"It's the night before Christmas and Gabe Snow, a tabloid writer haunted by the Ghosts of Christmas past, is investigating a Yule Tide conspiracy. Gabe knows that Flight 1225 was brought down one foggy Christmas Eve, by a flying creature with a ""glowing nose"". Now, a blood-sucking Vampire - Santa Claus - has put Gabe on his list and unleashed the demonic fury of the No... Leer todo",85,Two Front Teeth
1120,5.2,Nahala Johnson,Nahala Johnson,"Homeboy Cameron tries to juggle his time between his girlfriend Sandy, the record label, and hanging out with his boyz. But his relationship with Sandy eventually sours when Cameron devotes more time to his friends. Tired of his lies and excuses, Sandy ends the relationship. Dealing with depression from the breakup.",82,Dominos: The Games We Play
1121,7.1,Yasuichirô Yamamoto,"Gôshô Aoyama, Hiroshi Kashiwabara",Conan and Kogoro Mori was tasked to solve a crime on a given time. The lives of their loved ones(as well as their own) are on the line. Solving the mystery means saving everyone.,111,Meitantei Conan: Tanteitachi no requiem
1122,7.0,Neten Chokling,Neten Chokling,"Milarepa is a tale of greed and vengeance - demons, magic, murder and redemption. It is the story of the man who became Tibet's greatest mystic.",90,Milarepa
1123,2.7,Leigh Scott,Leigh Scott,A team of vampire hunters set out to battle an evil vampire clan in the dark underworld.,107,Dracula's Curse
1124,6.3,Ryûhei Kitamura,"Isao Kiriyama, Ryûhei Kitamura, Tsutomu Takahashi","A man and a woman are together on the 'Chrysalis Day', the fatal day everything in your life will be decided depends on how you spend the day. A violent man holding pure love, Sai and a stunningly beautiful playgirl, Sheila. While Sheila flees with a large sum of money, she is chased by a cool but violent gang, crazy killers and an out of control cop. No one can stop ... Leer todo",158,LoveDeath
1125,6.4,Yun-ho Yang,"Hie-jae Kim, Yun-ho Yang","After 1988 Seoul Olympic, Ji Kang-heon, who is sentenced for 7 years, and other inmates escape from the police van. After escaping, Ji Kang-heon and inmates make the entire Seoul under fear while they hold hostages.",122,Holli-dei
1126,5.2,Jeong-woo Kim,Jeong-woo Kim,"Im Jung Hwan is a playboy from rich family. He is a simple minded who likes to fooling around, wasting money for the girls and living his playboy lifestyle. He has not yet graduated from college majoring in drama after nine years.",104,Guseju
1127,4.6,Poj Arnon,Poj Arnon,"Five undercover agents, each with her own specialty, must combat international terrorists who have come to Thailand. They must use every resources available and known to them as this mission will be one that is unlike any they have known.",102,Chai lai
1128,5.1,Si-myung Lee,"Soon-Wook Jeon, Se-Gyeom Kim","A mosquito from Transylvania finds its way to Seoul where it bites Na Do-yol, a corrupt police officer. Soon after he begins to develop a thirst for blood, and finds out that he has vampire super powers whenever he becomes sexually aroused. When Do-yol's past misdeeds come back to threaten his partner and girlfriend, he decides to clean up his act and sets out for rev... Leer todo",110,Heubhyeol hyeongsa na do-yeol
1129,5.6,Dong-won Kim,Seok-beom Kang,"Doo-sik (JUNG Jun-ho), the number two of a leading gang, the D-Dogs, is full of ambition and expectation, for his once in a life time opportunity to be back to school not as a student, not a guard, but as a student teacher! It's really something for him, 'cause he already failed to complete his high school course years ago. Now it's kind of a second chance for him. He... Leer todo",124,Tusabu ilche
1130,5.4,Jing Wong,Jing Wong,No tiene argumento,90,Ye man mi ji
1131,2.7,Stuart Paul,"Simon Paul, Stuart Paul","A mysterious college professor becomes the focus of a murderer investigation when he is framed by his rival, Dr. Crazx, a Pulitzer prize winning psychiatrist.",138,The Legend of Simon Conjurer
1132,6.0,Jim Hickey,Bobby Allen,"Four guys set off on a world tour to enact the seven deadly sins. Based on the MTV Europe series ""Dirty Sanchez"".",94,Dirty Sanchez: The Movie
1133,5.2,Lasse Järvi,Michele Pacitto,"Beautiful girls and lethal weapons go hand-in-hand in this deadly, tongue-in-cheek, women in prison escape romp through the surburban streets of Detroit.",95,Alice in Wasteland
1134,No tiene datos,No tiene datos,No tiene datos,No tiene datos,No tiene datos,No tiene datos
1135,6.4,Quanie Cash,Quanie Cash,"In Cashville, two friend friends are torn apart by fast money and launch an all out street war where no one can be trusted. Loyalty and Respect is lost over Cash in the city of Cashville.",83,Loyalty & Respect
