,0,1,2,3,4,5
2912,3.1,James Boss,Vivian Kyinn,"Set in a wasteland enclosed by a large white wall, the last survivor from a brutal child internment camp reluctantly takes on one final bounty hunting job to protect the idyllic life he has rebuilt.",95,White Wall
2913,3.3,Sebastian Panneck,Christoph Willumeit,"A motley group of business students in Berlin, Germany sign up for Takahashi Corp.'s assessment weekend, hoping to land one of the coveted spots with the consulting company. Under the watchful eye of a company psychologist, the team-working and improvisational skills of the aspirants will be put to the test in a survival-type situation. But nothing goes according to p... Leer todo",93,Headhunter: The Assessment Weekend
2914,4.7,James Quattrochi,Salvatore Polisi,"NYC, 1972: After a bloody mob war all summer, the 5 mob families keep the peace at Sinatra Club with Gotti's upcoming silver heist as a joint venture.",88,Sinatra Club
2915,5.0,Francisco Aragon,Francisco Aragon,No tiene datos,101,Boyle Heights
2916,6.6,Ethan Maniquis,Robert Rodriguez,"Un exfederal se dispone a vengarse de su antiguo jefe, quien lo traicionó tras ordenarle que asesinara a un Senador texano.",105,Machete
2917,5.5,Jim Fitzpatrick,Jim Fitzpatrick,A group of kids take down a motorcycle gang.,83,Adventure Scouts
2918,7.3,Tom McGrath,Alan Schoolcraft,"El supervillano Megamind finalmente derrota a su némesis: el superhéroe Metro Man. Pero sin un héroe, pierde todo propósito y debe dar un nuevo sentido a su vida.",95,Megamind
2919,7.4,Tejas Dhhanraj,Tejas Dhhanraj,A carefree guy who lands himself and family in trouble when he comes across a goon Lallan Pandey.,No tiene datos,He - The Only One
2920,6.3,James Mangold,Patrick O'Neill,Una joven es confundida por una espía caída en desgracia que está intentando limpiar su nombre.,109,Noche y día
2921,5.1,Kevin Munroe,Thomas Dean Donnelly,"Las aventuras del investigador privado sobrenatural, Dylan Dog, que busca a los monstruos del pantano de Luisiana con su característica camisa roja, chaqueta negra y vaqueros.",108,Dylan Dog: Los muertos de la noche
2922,No tiene datos,Isaac Combs,Isaac Combs,A Los Angeles crime saga focuses on a detective who turns his back on his drug lord younger brother.,101,Deal
2923,6.3,Neil Marshall,Neil Marshall,Un grupo disidente de soldados romanos lucha por su vida tras las líneas enemigas después de que su legión sea devastada en un ataque de guerrilla.,97,Centurión
2924,3.8,Kim Bass,Kim Bass,"Mejores amigos vuelan aviones de alta tecnología, para llevar drogas desde México a California con el fin de financiar su estilo de vida.",113,Speed asesino
2925,6.2,Sngmoo Lee,Sngmoo Lee,"Un maestro samurái se ve obligado a huir de Asia y ocultarse en un pueblo de Estados Unidos, junto a un bebé que es el último miembro de un linaje enemigo. Pronto se verá en medio de una gran batalla.",100,El camino del guerrero
2926,6.8,Albert Hughes,Gary Whitta,Un hombre solitario se abre camino a través de una América postapocalíptica para proteger un libro sagrado que contiene los secretos para salvar a la humanidad.,118,El libro de Eli
2927,5.3,Scott Stewart,Peter Schink,"Un grupo de desconocidos en un bar de carretera es atacado por fuerzas demoníacas. Su única oportunidad de sobrevivir es un arcángel llamado Miguel, que informa a una camarera embarazada que su hijo será la esperanza de la humanidad.",100,Legión
2928,3.1,Gordon Chan,Rita Augustine,"Live-action feature based on the video game ""King of Fighters"".",93,The King of Fighters
2929,5.5,Andy Tennant,Sarah Thorp,"Un cazador de recompensas descubre que su próximo objetivo es su mujer, una reportera que está investigando un caso de asesinato encubierto. Tras reencontrarse, se dan a la fuga para salvar sus vidas.",110,Exposados
2930,4.1,Andrey Konchalovskiy,Andrey Konchalovskiy,"En la década de los 20, en Viena, una niña recibe una muñeca mágica en Nochebuena.",110,El cascanueces: la historia no contada
2931,6.3,Miguel Sapochnik,Eric Garcia,"En un futuro próximo, un hombre que no puede acabar de pagar la hipoteca en su corazón trasplantado se da a la fuga antes de que los prestamista lo recuperen.",111,Repo Men
2932,No tiene datos,Tanikella Bharani,No tiene datos,No tiene datos,No tiene datos,Bhairava IPS
2933,3.9,Eric Etebari,Robert Redlin,Can a determined single mom go the distance and win the tournament that could ultimately lead to a better life for her and her daughter?,90,Bare Knuckles
2934,No tiene datos,Anand Kumar,Aryan Saha,No tiene argumento,107,Private Number
2935,4.1,Davi de Oliveira Pinheiro,Davi de Oliveira Pinheiro,"In a devastated post-apocalyptic world where the rules of reality are transformed by magic and madness, a vengeful police officer searches for a possessed serial killer in a battle of the not-so-good versus absolute evil.",89,Beyond the Grave
2936,4.7,Jimmy Hayward,Mark Neveldine,El ejercito de Estados Unidos ofrece a un cazarrecompensas una oferta que no puede rechazar: tiene que detener a un terrorista a cambio de su libertad.,81,Jonah Hex
2937,3.3,Juan Carlos Vargas,"Juan Carlos Vargas, John Azpilicueta","Ten actors audition on a reality show for a million dollars. All they have to do is survive three killers, and each other - streaming live over the Internet.",87,Elimination
2938,5.7,Hilbert Hakim,Joshua Leibner,"A botched car-jacking forces two white-collar criminals to take refuge in the home of the thugs that accosted them. Over the course of one explosive, unpredictable night, worlds collide, fortunes shift, lives are cast aside and the most unsuspecting of heroes walks away with a multimillion dollar score.",105,Krews
2939,5.2,Cyrill Boss,"Cyrill Boss, Philipp Stennert, Andreas Gaw",Jerry Cotton is the best agent of the FBI and suspected of murder. So he has to find the real killers of gangster boss Serrano.,90,Jerry Cotton
2940,6.2,Assad Raja,"Jens Dahl, Assad Raja, Nicolas Winding Refn",Un traficante de drogas desesperado debe evitar a la policía y encontrar dinero para pagar una enorme deuda.,107,Pusher
2941,5.2,Robert Kurtzman,Alexander Vesha,A police officer with a painful past returns home to help the FBI track down a mastermind assassin.,96,Impacto mortal
2942,4.0,Robert Arevalo,Robert Arevalo,"Saltillo, a small dusty town south of the Mexican border, caught in a war of greed and corruption. A man named Bishop returns home after his parents are executed at the hands of a ruthless drug lord El Chilango. He swears to avenge the deaths of his loved ones and take down every person involved at the cost of losing himself and his new love Lucia, the wife of his new... Leer todo",100,Mexican Bloodbath
2943,No tiene datos,Florin Calin,"Flavius Iordaiche, Florin Calin, Mihaela Ceapa",No tiene argumento,115,Orsova Noua 5: Epilog
2944,3.2,Peter Atencio,Scott Martin,"En medio de una tormenta tropical, la tripulación de una plataforma petrolera en alta mar debe sobrevivir al ataque de una criatura después de invadir su hábitat submarino.",94,The Rig
2945,7.4,Jean-Claude Van Damme,Jean-Claude Van Damme,"A military veteran and former mercenary named Frenchy is haunted by his childhood, as well as his past in the military.",108,The Eagle Path
2946,5.4,Robert Luketic,"Bob De, Rosa","Una mujer de vacaciones conoce al hombre ideal, con el que rápidamente se casa. De vuelta en casa, su idilio se desvanece cuando descubren que sus vecinos podrían ser asesinos a sueldo contratados para matarlos.",100,Killers
2947,6.8,Joseph Kosinski,Edward Kitsis,"El hijo del diseñador de un mundo virtual va en busca de su padre y acaba en el mundo que su padre creó, donde conoce a su corrupta creación y a un aliado que ha nacido en este universo.",125,Tron: Legacy
2948,7.9,Roberto Monticello,Doug Klozzner,Kids are forced to participate in a secret fight club run by town officials.,88,You Have the Right to Remain Violent
2949,3.8,Angel M. Huerta,Armando Guajardo,Owal Tec investigates the paranormal activities that are taking place around the country.,110,Seres: Genesis
2950,7.0,Jeff Tremaine,Jeff Tremaine,"Los chicos de Jackass han vuelto, así que prepárate para contemplar, desde una distancia segura e higiénica, las increíbles, explícitas y no censuradas actividades de estos entrañables idiotas.",94,Jackass 3D
2951,6.6,Hark Tsui,Chia-Lu Chang,Un detective exiliado es reclutado para resolver una serie de misteriosas muertes que amenazan con retrasar la toma de posesión de la emperatriz Wu.,123,Detective Dee y el misterio de la llama fantasma
2952,No tiene datos,No tiene datos,No tiene datos,No tiene datos,No tiene datos,The Beautiful Outsiders
2953,6.4,Stevan Filipovic,"Stevan Filipovic, Stasa Koprivica, Dimitrije Vojnov",Life is sometimes rude game: one mistake can buy you ticket to hell.,102,Sisanje
2954,6.1,William Kaufman,William Kaufman,Two New Orleans cops are up against an extremely violent gang.,104,Sinners and Saints
2955,6.2,John Luessenhop,Peter Allen,A group of bank robbers find their multi-million dollar plan interrupted by a hard-boiled detective.,107,Ladrones
2956,4.6,Fabrice Genestal,"Paul Besson, Fabrice Genestal",A hot young Wall Street trader finds a formula based on climatology to play the market and win big... but at what cost?,85,Krach
2957,9.1,V. Nagaraj,"C. Kumaresan, Jasmine Michael, K.K. Khanna",No tiene argumento,120,Undercover Rascals
2958,2.2,Albert Pyun,Cynthia Curnan,A princess is on a quest to unite the five greatest warriors to save her kingdom from a demon sorceress.,86,Tales of an Ancient Empire
2959,5.7,Hae-sung Song,John Woo,"Arms trafficker Hyuk and Young-chun are practically brothers and nothing can separate them. When the two managed to escape from North Korea, they left behind Hyuk's younger brother Chul. Hyuk can never shake off the guilt as his family was punished for his treason and his mother died in prison. Three years later, Chul finally makes his way to South Korea and join the ... Leer todo",124,Moo-jeok-ja
2960,6.2,Harald Zwart,Christopher Murphey,"Una madre soltera tiene que mudarse a China con su hijo por trabajo. En su nuevo hogar, el niño se acoge al kung-fu bajo el tutelaje de un maestro.",140,The Karate Kid
2961,6.6,Richard Berry,Franz-Olivier Giesbert,"Un mafioso retirado trata de vengarse, después de que su antiguo amigo de la infancia lo haya dado por muerto con ventidós balas en su cuerpo.",117,22 balas
2962,No tiene datos,Malik Imdad Hussain,Malik Imdad Hussain,No tiene datos,No tiene datos,Jabroo Te Nizam
2963,6.4,Pierre Morel,Adi Hasak,"En París, un joven empleado de la oficina del embajador de los Estados Unidos se involucra con un espía estadounidense que busca detener un ataque terrorista en la ciudad.",92,Desde París con amor
2964,6.3,Luc Besson,Luc Besson,"En 1912, la periodista Adèle viaja a Egipto para hacerse con una momia. Su intención es encontrar la cura para su hermana, pero lo único que logra con su experimento es resucitar un huevo de pterodáctilo que provoca el pánico en París.",107,Adèle y el misterio de la momia
2965,6.4,Christopher Smith,Dario Poloni,"Ambientada en la época del primer brote de peste bubónica en Inglaterra, a un joven monje se le encomienda la tarea de averiguar la verdad sobre los informes de personas que vuelven a la vida en un pequeño pueblo.",102,Black Death (Garra negra)
2966,6.1,Guy Moshe,Boaz Davidson,Un joven se ha pasado la vida buscando venganza solo para enfrentarse a un desafío mayor del que esperaba.,124,Bunraku
2967,No tiene datos,No tiene datos,No tiene datos,No tiene argumento,93,Barcelona vs Real Madrid
2968,3.1,Neil Jones,Neil Jones,"The world may be recovering from a global zombie outbreak, but that's not stopping Dean from marrying. The stag party, along with a PVC-clad stripper they've hired, go to play Zomball - like paintball, except that you get to shoot zombies.",81,Stag Night of the Dead
2969,4.6,Anil Sharma,Shailesh Verma,Prithvi seeks revenge on Gyanendra Singh and the British. He sends his son Veer to Britain to study their plans. Veer kills Gyanendra's son but ends up falling in love with his daughter.,169,Veer
2970,5.1,Andrés Couturier,"Emmy Laybourne, Sam Laybourne, Rob Sosin","Join Mr. Magoo and his nephew, Justin, as they dodge giant robotic spiders and jetski ninjas on a kung fu-style adventure! When supervillian, Tan-Gu, invites the world's most notorious bad guys to compete in the ""Evil-lympics,"" there's only one person who can put a stop to the wickedness and save mankind--Kung Fu Magoo!",79,Kung-Fu Magoo
2971,6.5,Volt Jones,Eric Jacobus,A hit man must battle Italian and Chinese criminal organizations to be with the woman he loves.,90,Dogs of Chinatown
2972,4.3,Kireet Khurana,Raagi Bhatnagar,A reel-life costumed actor is abducted and asked to be a real hero by Toon characters.,95,Toonpur Ka Superrhero
2973,3.4,Adamo P. Cultraro,Adamo P. Cultraro,A ruthless mafia hit man is transformed when he rescues a woman who takes the fall for one of his hits.,77,Corrado
2974,5.4,J.A. Steel,J.A. Steel,A Creature terrorizes a small town and it is up to a small group of scientists to stop it.,83,Denizen
2975,No tiene datos,No tiene datos,No tiene datos,No tiene argumento,90,FC Barcelona vs Hércules CF
2976,6.0,Anurag Basu,Anurag Basu,"A wounded man searches for his sweetheart in the Mexican desert while on the run from the police, bounty hunters, and others.",123,Kites
2977,No tiene datos,Jermaine Jenas,No tiene datos,No tiene datos,92,Birmingham City vs Tottenham Hotspur
2978,No tiene datos,Douglas Rath,"Anthony Bravo, Douglas Rath",Ex-convict hunts down a trio of thrill killers over 24 bullet riddled hours.,110,Id
2979,7.7,Aram Rappaport,Aram Rappaport,"Based on a true incident, Innocent, also known as Helix, is the compelling tale of five disparate lives that become inextricably entangled one cold Chicago morning. Told in real-time, Helix is America's first action crime drama ever to be shoot in one continuous take without any edits. Ashley, a beautiful young woman is abducted by two desperate urban youths. A street... Leer todo",98,Innocent
2980,3.4,J. Stephen Maunder,J. Stephen Maunder,"During a military raid to rescue in Iraq, Max Forrester's teammate and girlfriend Sasha, disappears mysteriously. Two years later, Max, who has since retired from the army receives a call from his former commander Captain Dyer, who informs him that Sasha is still alive and is in a place called Paradise Island, and also inform him that the army is ready to take action ... Leer todo",87,Shadows in Paradise
2981,No tiene datos,Coier Amerson,Coier AmersonDarryl Quarles,No tiene datos,85,Mercy
2982,4.2,Keith Parmer,Keith Parmer,"Time is running out for two elite criminals as they seek out revenge to get the money they are owed after a heist gone wrong years ago. They've traveled across the country, tracked down their ex-partner, and planned every detail of their attack. When they finally come face-to-face, these two criminals refuse to back down until they get what belongs to them.",97,Tic
2983,6.9,Zack Snyder,John Orloff,"Cuando un joven búho es secuestrado por un ejército de búhos malvados, debe escapar con nuevos amigos y buscar a los legendarios Guardianes para detener la amenaza.",97,Ga'Hoole La leyenda de los guardianes
2984,5.8,Paul W.S. Anderson,Paul W.S. Anderson,"Mientras sigue intentando destruir a la malvada Corporación Umbrella, Alice se une a un grupo de supervivientes que viven en una prisión rodeada de infectados que también quieren trasladarse al misterioso refugio conocido como Arcadia.",96,Resident Evil: Ultratumba
2985,2.5,Kantz,Barry Louis,Tony is in a race against time to save his kidnapped wife before she is murdered but as he unravels the mystery behind her abduction he discovers they are after more than money.,86,Urgency
2986,5.2,Nic Auerbach,Tim Cunningham,"A cruel twist of fate catapults small time crook Mickey Skinner into the big league, as head of a brutal London gang poised on the brink of a lucrative human-trafficking deal",105,The Big I Am
2987,6.6,Martin Campbell,William Monahan,"El detective de homicidios Thomas Craven investiga la muerte de su hija, una activista, y descubre secretos oscuros y los esfuerzos corporativos por encubrirlos.",117,Al límite
2988,No tiene datos,Péter Karácsony,Péter Karácsony,No tiene argumento,80,Around Hell
2989,6.9,Jon Favreau,Justin Theroux,"Con el mundo sabiendo que es Iron Man, Tony Stark debe lidiar tanto con su salud en declive como con un loco vengativo con vínculos con el legado de su padre.",124,Iron Man 2
2990,3.6,Simone Bartesaghi,"Philip Kim, Neil Kinsella","El futuro de Estados Unidos, cuando el mundo se quede sin petróleo.",101,Downstream
2991,6.2,June Daguiso,June Daguiso,No tiene datos,No tiene datos,Collide
2992,7.3,Na Hong-jin,"Won-Chan Hong, Na Hong-jin","Cuando el intento de matar a un profesor sale mal, se desencadenan una serie de eventos violentos que obligan al taxista a correr por su vida.",157,The Yellow Sea
2993,6.7,Jonathan Lynn,Lucinda Coxon,"Un asesino a sueldo intenta retirarse, pero una hermosa ladrona puede cambiar sus planes.",98,Blanco escurridizo
2994,3.0,Tom Shell,Jennifer Lee Loy,"When Captain Kyle Fierson's unit is ambushed during a raid to rescue a deadly nuclear device, he must run for his life - not only to track down the missing time bomb, but also to clear his name when he is accused of aiding the terrorists.",98,Desarmado
2995,4.4,Kim Sønderholm,Kim Sønderholm,Frank is a police officer who loses his family in a tragedy. In desperation he turns to crime and makes a living as a hitman for the mob.,91,Tour de Force
2996,6.0,Florian Henckel von Donnersmarck,Florian Henckel von Donnersmarck,Frank es un turista estadounidense que visita Italia para reparar un corazón roto. Elise es una mujer extraordinaria que se cruza deliberadamente en su camino.,103,The Tourist
2997,7.0,Robert Schwentke,Jon Hoeber,"Cuando su pacífica vida se ve amenazada por un asesino de alta tecnología, el exagente de operaciones encubiertas Frank Moses vuelve a reunir a su antiguo equipo en un último esfuerzo por sobrevivir y descubrir a sus agresores.",111,RED
2998,3.3,Jordi Llompart,Jordi Llompart,A young girl named Jana takes a magical journey to Africa.,90,Viaje mágico a África
2999,2.9,Jeremiah Hundley,Jeremiah Hundley,"""In the deep jungles of South East Asia a blood thirsty mercenary Sebastian, hunts for the thrill of the chase and victims to sell into slavery. In one operation he kills a peaceful local shaman Aroon, and his family. As Sebastian leaves with his catch, Aroon dies... only to come to life the next day. Something has happened to Aroon, a gift to some, but a curse to him... Leer todo",90,The Lazarus Papers
3000,5.0,Romeo Antonio,"Romeo Antonio, Henry A. Miller, Robert Rothbard",Four childhood friends double as Arizona State University College Students by day and major drug lords by night.,No tiene datos,Rollers
3001,7.6,Matthew Vaughn,Jane Goldman,"Dave Lizewski es un estudiante de instituto que pasa desapercibido. Adora los cómics y un día decide convertirse en superhéroe, aunque no tiene ningún poder ni entrenamiento.",117,Kick-Ass: Listo para machacar
3002,3.1,Ric La Monte,Ric La Monte,"A simple man, Dr. Walter Newman, has high aspirations to cure all disease through genetic manipulation. His obsession with his mission draws him deeper into his own dark world, distracting him from his wife Olivia and from his responsibilities to his patients at the Edgewood Asylum. The doctors loyal but diabolical nurse, Ms. Tinsley, decides to take matters into her ... Leer todo",96,The Tenant
3003,5.1,Dolph Lundgren,Raul Inglis,A Soviet-trained assassin is determined to escape his double life as a hitman and as a husband-father.,88,Icarus
3004,7.1,Amazon Bob Carter,Amazon Bob Carter,"Two bounty hunters, Demon Jones and The Babe, go to Catalina Island to pick up a bond jumper and find the island crawling with what they think are zombies.",147,Dead in the Head
3005,4.1,Tiller Russell,Tiller Russell,A western centered on a woman trying to bring her outlaw lover home for his burial.,83,El Último Rito de Ransom Pride
3006,4.9,Fouad Mikati,Sam Levinson,A battle ensues among groups of government spy teams in an underground facility after their boss is assassinated.,87,Operación: Juego final
3007,5.5,Adam Green,Adam Green,"Marybeth escapes the clutches of the bayou-butcher Victor Crowley and returns to the swamp with an army of hunters and gunmen, determined to end Crowley's reign of horror once and for all.",85,Hatchet II
3008,6.6,Andrey Kavun,Andrey Kavun,"Based on the true story of five Russian pilots captured by the Taliban. They are forced to spend three-hundred-seventy-eight days in hell, while facing questions of loyalty, survival and planing their treacherous escape route home.",103,Kandagar
3009,No tiene datos,Sebastien Ricci,Sebastien Ricci,No tiene argumento,89,Ascension
3010,No tiene datos,No tiene datos,No tiene datos,No tiene datos,No tiene datos,No tiene datos
3011,4.9,No tiene datos,No tiene datos,No tiene datos,97,An Immortal Tale
3012,No tiene datos,No tiene datos,No tiene datos,No tiene argumento,No tiene datos,Liverpool vs Blackpool
3013,No tiene datos,No tiene datos,No tiene datos,No tiene argumento,No tiene datos,2010 Championship Playoff Final
3014,No tiene datos,Ramana Mogili,Ramana Mogili,No tiene argumento,No tiene datos,Mard No.1
3015,3.5,Hadi Abrar,"Kumaar, Reshu Nath, Krupasagar Sridharan","While playing a video game on TV, school-children are mysteriously transported to a prehistoric island.",120,Ramaa: The Saviour
3016,3.0,Iftekhar Jahan,Merian C. CooperDelwar Jahan JhantuEdgar Wallace,No tiene datos,143,Banglar King Kong
3017,No tiene datos,Ken Annakin,"James Carrington, Andrzej Krakowski, Bulat Mansurov","The fate of a legendary boy, Temudjin, later the Genghis Khan, who became the most powerful emperor of Mongolia. With his army created one of the largest empires of all time.",No tiene datos,Genghis Khan: The Story of a Lifetime
3018,2.8,Ted Fox,Ted Fox,"Stephan Bonnar is Troy Jennings, a mixed-martial-arts superstar whose girlfriend is kidnapped by ex-fighter Lucien Gallows. In a desperate attempt to rescue her, Troy must challenge eight fighters and face Gallows in a fight to the death.",86,Supreme Champion
3019,7.6,Keith Mosher,David Sean Greider,"You ever have one of those days? Follow Gruff as he has one of the longest days ever. It all starts when Tony Revario (the Boss of a prominent Las Vegas crime family) sends Vinnie and Rocco to find an accountant, that embezzled a lot of money from the Revario Crime Family. Vinnie and Rocco get the wrong apartment and the wrong guy. They end up in Gruff's apartment and... Leer todo",85,One Long Day
3020,No tiene datos,No tiene datos,No tiene datos,No tiene datos,No tiene datos,Jitsuroku wakagashira
3021,6.3,Sanjay Puran Singh Chauhan,Sanjay Puran Singh Chauhan,A cricketer turns kick-boxer in order to avenge the death of his brother.,145,Lahore
3022,3.6,Keith Alan Morris,Keith Alan Morris,"Gutter King is an urban coming-of-age fight drama about a tough street kid just released from the Juvenile Department of Corrections. His new foster father tries to channel the boy's rage into the world of amateur bare-knuckle brawling, but his jealous brother has other plans.",98,Gutter King
3023,4.3,Brad Peyton,Ron J. Friedman,La guerra en curso entre las especies canina y felina queda en suspenso cuando unen sus fuerzas para frustrar a una espía felina con sus propios planes siniestros de conquista.,82,Como perros y gatos: La revancha de Kitty Galore
3024,No tiene datos,Arthur J. Mangano,Arthur J. Mangano,An ex CIA Agent comes out of retirement to protect his country from an evil take over leader.,114,A Goldfish of the Flame
3025,5.4,Carmen Madden,Carmen Madden,"Since closing the door to a violent past, quiet and thoughtful Moses Stanton everyday existence is running a small neighborhood store, and watching over his daughter who doesn't know he exists. When a young man, Malik, comes in claiming to be a black Muslim that is doing good for the neighborhood, Moses takes him on as a partner but soon realizes that Malik is nothing... Leer todo",105,Everyday Black Man
3026,6.7,Daniel Espinosa,Daniel Espinosa,"Cuando JW se convierte en un narcotraficante para mantener su doble vida, su destino se vincula con otros dos hombres: Jorge, un fugitivo que huye de la mafia y la policía serbia, y el mafioso Mrado, que está a la caza de Jorge.",124,Dinero fácil
3027,5.9,Faruk Kabir,"Faruk Kabir, Sarim Momin","Two impoverished youth take to crime, are held in a juvenile home, and become gangsters after being discharged.",123,Allah Ke Banday
3028,3.7,Mitchell Klebanoff,Mitchell Klebanoff,"An orphaned boy who dreams of being a ninja arrives in Hollywood to try and find his birth parents, where he gets mixed up in a crime.",98,Dancing Ninja
3029,3.5,S.J. Creazzo,S.J. Creazzo,"Mountain guide, Emily Wilks, is forced to lead a group of men up the perilous Devil's Peak. But leading the group up Devil's Peak is just a stalling tactic until Emily reveals her own dark secret.",No tiene datos,Venganza en la cumbre
3030,6.1,Ari Taub,Caio Ribeiro,"Set in Northern Italy during the last embers of the war, the beleaguered vanguard of Axis forces suffer daily bombings and the constant threat of attack from local partisans. Tempers begin to flare between these 'allies' as they await their impending doom.",88,Last Letters from Monte Rosa
3031,7.1,S. Shankar,S. Shankar,Un científico brillante crea un robot humanoide para proteger a la humanidad.,155,Enthiran
3032,5.4,Tony Krantz,Erik Jendresen,A private detective is hired to find a missing stripper. A simple job turns complicated when everyone he questions ends up dead.,101,La partícula de Dios
3033,7.1,Elijah Drenner,Elijah Drenner,"A documentary about the history of exploitation movies, from the silent-film era to the 1970s.",80,American Grindhouse
