,0,1,2,3,4,5
1983,6.7,Henric Brandt,"Stefan Bommelin, Henric Brandt",A young couple out on a romantic vacation accidentally get involved in a showdown between criminals. They become two witnesses who has to be silenced.,104,Död vid ankomst
1984,6.6,Marc Forster,Paul Haggis,James Bond se sumerge en el misterio mientras intenta impedir que una enigmática organización elimine el recurso más valioso de un país.,106,Quantum of Solace
1985,No tiene datos,No tiene datos,No tiene datos,No tiene datos,No tiene datos,No tiene datos
1986,2.7,Conrad Glover,Christine Dynan,A local street gang finds a briefcase full of money in an abandoned building. The gang later finds out that the money that they have in their possession belongs to one of New York's biggest crime families.,99,Street Revenge
1987,6.7,Rian Johnson,Rian Johnson,"Los hermanos Bloom son los mejores estafadores del mundo, estafando a millonarios con historias de lujuria e intriga. Su último trabajo: darle a una bella heredera el romance de su vida en una aventura que los llevará por todo el mundo.",114,Los hermanos Bloom
1988,3.9,Eeshwar Nivas,"Mayur Puri, Lajan Joseph","Riya lives a middle-classed lifestyle in Mumbai and works as an Assistant Director for a movie producer, Bharucha. After the passing of her mother, she is consoled by a young man, Anthony Gonsalves, in the church graveyard. He introduces himself as the son of Jeffrey, who passed away during 1986, and works as a waiter in Jimmy's Pub, Bandra and wants to be a Bollywood... Leer todo",136,My Name Is Anthony Gonsalves
1989,5.8,Marc Gracie,"Chris Thompson, Marc Gracie",A man hunts down buried treasure in the Australian outback from World War II with the help of an unlikely accomplice.,74,The Tumbler
1990,3.4,Ross Boyask,Chris Regan,"Ten men took away his life. Now ten men will pay with their's. Ryan is left for dead, but returns to his old ways for one last revenge trip. And it's going to be bloody!",90,Ten Dead Men
1991,6.7,Neil Thompson,Geoff Thompson,"An underworld drama set in the early 1980s, about a lonely factory worker whose life is transformed when he becomes a nightclub doorman.",95,Clubbed
1992,5.2,Rob Cohen,Alfred Gough,"En el Lejano Oriente, Alex O'Connell, hijo de los famosos luchadores contra las momias Rick y Evy O'Connell, desentierra la momia del primer emperador de Qin, una entidad que cambia de forma y que fue maldecida por una bruja hace siglos.",112,La momia: La tumba del emperador Dragón
1993,5.5,Geo Santini,Jason Hice,"When Troy turned on crime boss Dmitri Debartolla he was forced to leave Los Angeles and lay low in Miami. After two years, and the loss of his leg in a shootout with a Cuban crime syndicate, Troy returns to LA to reclaim what is rightfully his. A reunion with his former partners in a rundown hotel sets the stage for an explosive encounter where past and present collid... Leer todo",95,Hotel California
1994,6.5,Rob Minkoff,John Fusco,"Un descubrimiento de un adolescente estadounidense obsesionado con el kung-fu le envía a una aventura a China, donde se une a una banda de guerreros de artes marciales para liberar al Rey Mono encarcelado.",104,El reino prohibido
1995,2.8,Frank Pinnock,Dan Garcia,Joe Joe has just opened up his very own rim shop and things are going well until an evil loan shark comes to collect an old debt. With no money in the bank Joe Joe has 24 hours to come up with the cash or he loses everything.,81,The Rimshop
1996,6.1,Daniel Lee,"Ho-Leung Lau, Daniel Lee, Guanzhong Luo","Basado en ""Romance of the Three Kingdoms"" de Luo Guangzhong. Se ubica como una de las cuatro obras literarias más importantes de China.",102,Tres reinos
1997,5.5,Joshua Seftel,Mark Leyner,"Un asesino profesional del gobierno es enviado a una zona del Medio Oriente en conflicto donde se le asigna la tarea de eliminar a un líder muy peligroso, bajo el disfraz de chaperón de una estrella pop árabe.",107,Negocios de guerra
1998,6.5,Carlos González Morantes,"Carlos González Morantes, César Jaime",No tiene argumento,90,Crepúsculo rojo
1999,4.2,Jacqueline Falk,Jacqueline Falk,"Computerexperte Frank arbeitet in einer Bank und versucht vergeblich auf Sicherheitslücken im e-banking hinzuweisen. Als eine Kundin ihr Geld verliert und Frank ihr zu ihrem Recht verhelfen will, wird er gefeuert und landet wegen einer Anzeige der Bank in U-Haft. Im Gefängnis überredet ihn der Polizist Max, sich mit einem e-banking-Trick an der Bank zu rächen. Als Fra... Leer todo",90,Geld oder Leben
2000,4.1,David Murphy,David Murphy,"Over five thousand people illegally cross the border each day. There are areas where crime is at its highest, where criminals prey upon these defenseless groups. An elite task force is put together with high expectations of solving this problem that is plaguing our border. After only a few short years, the operation is shut down due to the weight of overwhelming polit... Leer todo",105,Border Lost
2001,5.8,Steve Barker,Rae Brunton,"In war-torn Eastern Europe, a mysterious businessman hires a group of mercenaries on a routine mission to protect him not knowing of the long-hidden secret that lies there.",90,El búnker
2002,4.5,Alan Pao,Kyle Kramer,"A young, wealthy club kid's life spirals downward into an out-of-control world of drugs, sex and violence.",98,Loaded
2003,7.2,Jee-woon Kim,Jee-woon Kim,"Dos forajidos, un cazarrecompensas y su rivalidad por poseer un mapa del tesoro mientras son perseguidos por el ejército japonés y los bandidos chinos.",139,"El bueno, el malo y el raro"
2004,5.1,David Michael O'Neill,Shawn TDavid Michael O'Neill,A day trader (Embry) and his fiancée (Robertson) get caught up in high stakes gambling.,91,Player 5150
2005,6.9,David Gordon Green,Seth Rogen,Un administrativo legal y el tipo que le vende marihuana acaban teniendo que darse a la fuga perseguidos por mafiosos y un policía corrupto tras presenciar el asesinato de un capo.,111,Superfumados
2006,3.1,Gerson Sanginitto,Eliese Besemer,"Martial arts champion Andre Lima's fighting days ended with his wife's death. The past nine years Andre has struggled to rebuild his world around his two children. When his daughter's health suddenly fails, his finances collapse.",86,Beyond the Ring
2007,7.2,Ole Christian Madsen,"Lars Kristian Andersen, Ole Christian Madsen",Un drama centrado en dos combatientes del grupo de resistencia Holger Danske de la II Guerra Mundial.,130,Flame y Citrón
2008,3.0,Andrew Prowse,"Richard Manning, David Kemper","Gradually people notice the heat index is rising, and that all life on Earth is at risk, for a hoard of alien dinosaurs want to take over; until a soldier and a ex-model step in to take back planet Earth.",83,Ultimátum al Planeta
2009,5.8,Gregg Bishop,Joe Ballarini,"On the night of the big High-School Prom, the dead rise to eat the living, and the only people who can stop them are the losers who couldn't get dates to the dance.",87,Dance of the dead: El baile de los muertos
2010,6.1,Thomas Vincent,Éric Besnard,A man investigating his son's death learns some horrific truths about the pharmaceutical industry.,92,Le nouveau protocole
2011,1.8,Y.V.S. Chowdary,"Sai Krishna Biyyapu, Ramana Chintapally, Y.V.S. Chowdary","Veera Venkata Satyanarayana Swamy(Balakrishna) is a good samaritan. He helps his fellow villagers in their need. When the police blame him for a few murders, a vigilante named Okka Magadu(Balakrishna) takes the blame. Who is Okka Magadu? How is he related to Swamy's grand mother?",150,Okka Magadu
2012,4.9,Graham Cantwell,Anthony Fox,"When Anton O'Neill returns home after five years at sea, he finds that 1970s Ireland is a radically different place from the one he left behind. Northern Ireland is in flames, and civil unrest has spilled south of the border to his beloved home in County Cavan. Blinded by hatred and misguided patriotism, Anton is led into an illicit world of violence and forced to cho... Leer todo",95,Anton
2013,6.9,Jae-young Kwak,Jae-young Kwak,"A lonely university student develops a romance with a beautiful interesting woman, who turns out to be a cyborg from the future.",115,Cyborg She: Cyborg Girl
2014,7.8,Pierre Morel,Luc Besson,"Un agente jubilado de la CIA viaja por Europa y confía en sus viejas habilidades para salvar a su hija, que ha sido secuestrada durante un viaje a París.",90,Venganza
2015,6.1,Daniel Alfredson,Kerstin Ekman,An examination of how the traditions of the Sami villagers in northern Sweden is confronted with modern day society.,95,Varg
2016,7.1,Ben Stiller,Justin Theroux,"A través de una serie de acontecimientos extraños, un grupo de actores que ruedan una película de guerra de gran presupuesto se ven obligados a convertirse en los soldados que están retratando.",107,Tropic Thunder: ¡Una guerra muy perra!
2017,6.2,Jacques Maillot,"Pierre Chosson, Jacques Maillot, Bruno Papet","The story of two rival brothers, one a pimp and the other a cop, and how the former manages to be the family favorite.",106,Rivales (Les liens du sang)
2018,7.0,Pat Cerrato,Paul Filipanics,No tiene datos,No tiene datos,Pesticide
2019,4.3,Terry Ingram,"Brook Durham, Kevin Leeson","ODYSSEUS, The Warrior King, has been away from Ithaca for twenty years. The first ten he spent fighting the Trojan War; the last ten he spent fighting to get home. Among his adventures is the tale Homer felt was too horrific to tell; the missing book of The Odyssey known as... THE ISLE OF THE MISTS.",88,Ulises y la isla de la niebla
2020,6.5,Guillaume Ivernel,Frédéric Engel Lenoir,A fantastic tale telling the adventures of two dragon hunters!,80,Cazadores de dragones
2021,5.5,Don Barnhart Jr.,Don Barnhart Jr.,"Born into the underground world of human trafficking and prostitution, luck gave Jerri and Marie one chance to break free. They took it and now the mob wants them back...with interest.",74,China Dolls
2022,6.6,Peter Flinth,"Jan Guillou, Hans Gunnarsson","The Knight Arn is sent on a last mission against Saladin. He has to win this battle, before he can go home to Sweden, and finally marry his Cecilia and start a family. But the peace back home is threatened by the Danes.",128,Arn: Riket vid vägens slut
2023,5.2,Raul Garcia,Manuel Sicilia,A group of animals look for a way off of an eccentric billionaire's own personal Noah's Ark.,97,El lince perdido
2024,2.6,Darrell Mapson,Willy Ortlieb,"While trying to find where her younger brother wandered off to, Jenny and David, must search an abandoned wrecking yard with a horrifying history.",88,Hot Rod Horror
2025,6.6,Jeremy Dean,Jeremy Dean,"Two government agents are sent to investigate a solid steel room that people enter, but don't come out of. They soon realize that the only way to discover the secret of the room's origin is to seek out the aid of an ex-magician/escape artist who has been convicted of murdering her husband. Little do they know that this merciless room is only the beginning of what will... Leer todo",89,Stratagem
2026,4.0,Thunder Levin,"Thunder Levin, George Saunders, George Saunders","Tras una erupción solar, un grupo heterogéneo de supervivientes del centro de la ciudad debe dejar a un lado su animadversión para escapar de un Los Ángeles ahora libre de pandilleros, pero infestado en cambio de zombis chupasangres.",90,Mutant Vampire Zombies from the 'Hood!
2027,4.8,Uwe Boll,Dan Clarke,"Halfway into the Vietnam War (1959-1975), a special US combat unit is sent to hunt and kill the Viet Cong soldiers in man-to-man combat in the endless tunnels underneath the jungle of Vietnam.",96,Tunnel Rats
2028,5.1,Fedor Bondarchuk,Eduard Volodarskiy,"A space traveler from the Earth of the 22th century - without wars, poverty and oppression - crashes on an unknown planet. Politically and economically that planet similar to the totalitarian human states of the 20th century.",115,La isla habitada
2029,5.3,Vitor Santos,"Chris Carberg, Vitor Santos","When wanted fugitive Prescott Roeh is caught up with by Bounty Hunters, Brock Hadley and Rahul Quadim, he retreats to his old hometown, Braxton, as do the hunters. It is in this small town that they will all come to terms with their past, present, and future.",110,Kill Zone
2030,3.4,David Presley,David Presley,"Three college cheerleaders (and after-school go-go dancers) use their martial arts skills to save their Sensei from mafia kidnappers, but must keep their extracurricular activities a secret to realize their Ivy League dreams at Brown.",81,Ninja Cheerleaders
2031,5.6,Brian Smrz,Chad Law,"Tras despertar en el hospital, un hombre da caza y asesina al tipo que lo dió por muerto durante un robo, pero la banda a la que este pertenecía buscará venganza.",94,En busca de un héroe
2032,6.2,Leonel Vieira,João Quadros,Two amateur thieves are hired to steal an extremely valuable Van Gogh painting from the abandoned farm of an Argentinian countess.,103,Arte de Roubar
2033,3.2,Matthew Hope,Matthew Hope,The year is 2015 and overpopulation and famine have plunged our planet into chaos and one desperate survivor finds himself being hunted and pursued by hordes of rage-crazed zombies.,89,The Vanguard
2034,5.0,Ryan Combs,Jacob L. Adams,"Años despues de haberse declarado culpable de los delitos que habia cometido su hijo, el antiguo gangster James ""ANIMAL"" Allen vive una sentencia de cadena perpetua en la prision de Folsom...",93,Animal 2
2035,4.4,Pete Riski,"Pekka Lehtosaari, Mr. Lordi, Pete Riski",A man emerges with his autistic daughter and three others from a hospital elevator to find themselves trapped in the building with devilish monsters.,85,Dark Floors (Piso siniestro)
2036,6.1,Jae-young Kwak,"Jae-young Kwak, Shinho Lee",A beautiful martial arts prodigy becomes a ruthless warrior to guard the world against the evil spell.,122,Mu-rim-yeo-dae-saeng
2037,5.1,Alec Joler,Aris Blevins,"Daniel loses his wife and son in a car accident. While slowly recovering from his injuries, he rebuilds his son's video camera that was destroyed in the crash. Infused with power from the moment of the crash, the camera develops the ability to stop time when Daniel presses the pause button. This discovery restores Daniel's purpose, and he fills the vacuum in his life ... Leer todo",95,Suspension
2038,6.9,Jeffrey Nachmanoff,Jeffrey Nachmanoff,"Cuando el estricto agente del FBI Roy Clayton investiga una peligrosa conspiración internacional, todas las pruebas parecen dirigir a Samir Horn, el director de operaciones especiales.",114,Traidor
2039,3.8,Vijay Krishna Acharya,Vijay Krishna Acharya,What happens when you throw 2 guys who hate each other together? Add for good measure a beauty and a gangster and the trouble is no one can be trusted.,120,Tashan
2040,7.2,Goran Markovic,Goran Markovic,"Year 1993, the bleakest time of war in Bosnia and Herzegovina. A group of actors from Belgrade, utterly unaware of what they're setting themselves up for, embark on a search for quick earnings - on a ""tour"" around the Serbian Krajina. However, there they are thrust into the heart of war and begin to wander from war front to war front, from one army to the next.",102,Turneja
2041,5.6,Ben Rock,Julia Fair,"A group enters a supermarket at closing time, shoots around and takes hostages. They believe aliens have arrived there then. Cops arrive outside.",85,Alien Raiders
2042,4.6,Justin Rhodes,Ric Moxley,A CIA assassin attempts to break out of the contract killing business to try to lead a normal life.,86,Contract Killers
2043,No tiene datos,Shakil. S. Saifee,No tiene datos,No tiene datos,No tiene datos,Danga
2044,4.9,Glen Pitre,"Chuck Walker, Glen Pitre, Chuck Walker","A dozen years after the Civil War, former slaves go on strike at a powerful judge's plantation.",112,The Man Who Came Back
2045,6.7,Abbas Alibhai Burmawalla,Shiraz Ahmed,Destiny makes two brothers- Ranvir and Rajiv - enemies of each other. Everything is fair in love and war.,149,Race
2046,4.8,Franklin Correa,Franklin Correa,"When Louie,(played by Chiko Mendez)a drunk who's life revolves around placing bets on various games wounds up having to pay Lefty(played by Donald Charles)the local bookie a great deal of money...a deal is made. Louie agrees to take a few of Lefty's white collar friends hunting agreeing to track down deer for them to hunt, but not knowing what to do he ask's for the h... Leer todo",70,The Prey
2047,3.9,Ryan Harper,Ryan Harper,"The film is about reincarnation and takes place in a purgatory where the dead still have human form and the world around them looks the same as the living world. However, the people living in this purgatory start to develop animal instincts. Gene, a retiree vacationing in Baja, is learning the instincts of a spider through his dreams and stumbles upon a woman who is d... Leer todo",88,Circulation
2048,4.7,James Isaac,Robert Mailer Anderson,"When John takes his friends to his deceased uncle's remote ranch to hunt wild pigs, it seems like a typical guys weekend. But as John and his crew trek deeper into the forest, they begin tracking the awful truth about his uncle's demise.",99,Pig Hunt
2049,6.5,Jeff Wadlow,Chris Hauty,Un adolescente frustrado y conflictivo llega a un nuevo instituto donde descubre la existencia de un club de lucha clandestino y conoce a un compañero que le obligará a pelear.,113,Rompiendo las reglas
2050,5.6,Dan Eberle,Dan Eberle,A wealthy out-of-towner hires an indigent man to abduct an estranged family member.,90,The Local
2051,4.8,Nick Vallelonga,Paul Sloan,"The seemingly random killings of an assassin puzzle her former lover, a wealthy Greek crime boss whose organization is jeopardized by his love for her, and the detective following her rising body count.",99,Stiletto
2052,7.3,Joachim Rønning,Thomas Nordseth-Tiller,La historia real de uno de los saboteadores más brillantes durante la Segunda Guerra Mundial y su batalla para vencer a sus demonios internos.,118,Max Manus
2053,2.8,Oleg Fesenko,"Andrei Libenson, Anush Vardanyan","After recovering from a tragic accident, a former street racer struggles to redeem himself and join the elite racing world.",109,Street Racer
2054,7.2,Guy Ritchie,Guy Ritchie,"En Londres, una estafa inmobiliaria deja millones de libras a disposición del primero que los tome, atrayendo a la peor calaña de la ciudad, todos esperando hacerse ricos rápido.",114,RocknRolla
2055,7.1,Edward Zwick,Clayton Frohman,"Unos hermanos judíos de Europa del Este ocupada por los nazis escapan a los bosques bielorrusos, donde se unen a los combatientes de la resistencia rusa, y se esfuerzan por construir una aldea.",137,Resistencia
2056,4.6,Sanjay Gadhvi,Yatharth Awasthi,A kidnapper has to settle a personal score with an influential businessman whose daughter he has kidnapped.,135,Kidnap
2057,5.7,N. Linguswamy,Sujatha,"Shekar is an ardent admirer of Chinna who runs an underworld gang. Once paired up, the two of them single-handedly take on the streets of Chennai. But Shekar falls in love and wants to be reformed.",169,Bheemaa
2058,5.8,Claude-Michel Rome,"Olivier Dazat, Claude-Michel Rome","A grizzled Parisian detective is sent to an outpost town in Southern France to dismantle a gang of killers which has freed a notorious criminal. The detective inherits a team of unmotivated and dishevelled detectives, and he makes connections nobody else ever saw because nobody else bothered to look. A mysterious, charismatic figure, he leads by example, and gradually... Leer todo",91,Les insoumis
2059,4.8,Kenta Fukasaku,"Mamoru Oshii, Futoshi Fujita, Takanori Tsujimoto",Four prominent Japanese directors and four short climax action stories.,82,Kiru
2060,4.9,Tak Sakaguchi,Ryûhei Kitamura,"A family is kidnapped by a couple who have guns. Wandering lost, they get together in a place where there are zombies in samurai armor. Encountering zombies and police, reunited family struggle and get to confront a tragic secret.",91,Yoroi: Samurai zonbi
2061,5.5,Rohit Shetty,Robin Bhatt,"An amnesiac woman fears a missing day in her life may connect her to a crime, and tries to retrace her steps between Saturday evening and Monday morning.",135,Sunday
2062,5.1,Sacha Bennett,Sacha Bennett,What happens when 3 groups of people decide to rob the same bank on the same day?,79,Tu£sday
2063,4.9,Tony Maylam,Tony Maylam,"Stephanie Komack was a high-class hooker and assassin for the Italian Mob. Now working in London as a waitress, and a single mother to her seven year old daughter, the Mob track Stephanie down and persuade her to do one last job. The hit goes wrong and Stephanie soon realises the stark reality of her failure. They snatch her daughter as punishment, but didn't figure o... Leer todo",90,Journal of a Contract Killer
2064,4.6,Adam Marcus,Adam Marcus,A wounded United States Marine discovers a corporate conspiracy designed to run illegal aliens out of an Arizona border town by any means necessary.,90,La conspiración del silencio
2065,5.0,Axel Sand,Lee Goldberg,An action movie centered around a group of street racers.,100,Fast Track: Competición ilegal
2066,6.1,Spike Lee,"James Mc, Bride","Ambientada en la Italia de 1944, narra la historia de cuatro soldados negros estadounidenses atrapados en un pueblo toscano durante la Segunda Guerra Mundial.",160,Miracle at St. Anna
2067,4.1,Steven Dieveney,Steven Dieveney,A stranded man loses his mind as his senses come to a turning point.,97,Big Game
2068,5.9,Noboru Iguchi,Noboru Iguchi,"Maimed while seeking revenge, a girl becomes stronger than ever.",96,Kataude mashin gâru
2069,6.3,Gordon Chan,"Ho-Leung Lau, Abe Kwong, Gordon Chan",An action-thriller centered on a vampire-like woman who eats the skins and hearts of her lovers.,103,Hua pi
2070,3.6,Joachim Masannek,Joachim Masannek,Un equipo de héroes se enfrenta a sus oponentes más peligrosos en el Reino de las Sombras: vampiros que juegan al fútbol.,107,Las fieras F.C. 5
2071,6.6,D.J. Caruso,John Glenn,"Jerry y Rachel son dos desconocidos que se encuentran a consecuencia de una llamada por parte de una mujer que ninguno de ellos conoce, pero que amenaza tanto sus vidas como las de sus seres queridos.",118,La conspiración del pánico
2072,6.5,Fumihiko Sori,Kan Shimozawa,"Ichi is a blind woman who roams about town with her shamisen (a three-stringed Japanese guitar), but she has exceptional sword skills with which she fights off yakuza and other villains.",120,Ichi
2073,2.0,Goldie Behl,Goldie Behl,"A young man learns he is the latest in line of a dynasty of ancestral warriors dedicated to guarding a mystic source of cosmic energy, and the time has come for him to take the role.",138,Drona
2074,7.0,Matt Reeves,Drew Goddard,Un grupo de amigos se aventura en las calles de Nueva York en una misión de rescate durante un ataque de un monstruo desenfrenado.,85,Monstruoso
2075,3.4,Giovanni Rodriguez,Laura Pratt,"In the isolated desert town of Caineville nothing and no one and nothing can be trusted, not even memories. Going home can be murder.",98,Red Canyon
2076,6.3,Kang Woo-suk,Jin Jang,KANG Chul-jung has been a detective fighting crime for 15 years and is at it again against a mob boss who recruits young kids to do his dirty work.,127,Kang Chul-jung: Gonggongui jeog 1-1
2077,5.9,Adrian Vitoria,"Ian Brady, Kevin Sampson, Adrian Vitoria","As a major heist approaches and with betrayal all around him, a respected crime boss has to summon all his street nous and killer instinct as he fights for survival.",123,Instinto Asesino
2078,3.5,Colin Theys,John Doolan,A group of college friends on a spring break camping trip are stalked and slashed by an unknown creature with the ability to make them hallucinate through sound waves.,86,Banshee!!!
2079,2.9,Murat Ergun,Murat Ergun,No tiene argumento,No tiene datos,Kiralik Oda
2080,6.5,Cesar Apolinario,"Cesar Apolinario, Mac Cruz, Cris Lim","Cris and Jason are two policemen with two opposite personalities and philosophies-Cris is the epitome of the rare, near-extinct breed of honest cops while Jason is the basurero, the legman/front man who does the dirty work of his district's high officials. Despite their contrasting natures, the two forge an unlikely friendship during their Special Weapons And Tactics ... Leer todo",110,Banal
2081,4.5,Chee Keong Cheung,"Chee Keong Cheung, Oliver Morran",It Is A 2008 Hong Kong British Action Martial Arts Film.,95,Bodyguard: A New Beginning
2082,3.8,Stephen Manuel,"Andreas Brune, Sven Frauenhoff","A young couple on the run takes the owner of a posh villa hostage after being surrounded by police, only to find that their ace in the hole is a dangerous serial killer.",94,Huida al infierno
2083,5.8,Shawn Seet,Rai Fazio,"This is a contemporary story set in Perth, Western Australia. Anthony Argo is a young Italian/Australian boxer, being pushed to the limit by his Sicilian father-trainer, Joe. Joe wants Anthony to achieve the success in the ring that he was denied as a young man. When Anthony meets Kate, he begins to see his life - and the role violence - in a different light. He loses... Leer todo",105,"Two Fists, One Heart"
2084,2.5,Amir Valinia,Tony Faia,Set in post hurricane New Orleans. A brutal Mexican drug lord busts out of jail to retrieve the $15 million that his girlfriend is hiding. Can he find the girl and the cash before the cops track him down?,83,Jump Out Boys
2085,2.9,John Poague,David Stever,"Cooper O'Neil's life changes when his former FBI partner arrives DOA with a thumb drive that's the key to a diabolical plot headed by a madman with an ax to grind. Welcome to Safehouse, where friends can be enemies and games can be deadly!",80,Safehouse
2086,3.9,Mike Eschmann,"Florian Gärtner, Jakob Hilpert, Rudolph Jula","When super-tough Instructor Schmidt tries to turn young German boys into men, his female military boss calls his leadership skills into question.",94,"Morgen, ihr Luschen! Der Ausbilder-Schmidt-Film"
