,0,1,2,3,4,5
0,6.5,Nicolas Boukhrief,Éric Besnard,Un hombre entra a trabajar a una compañía de camiones de seguridad para vengar la muerte de su hijo durante un asalto.,95,El transportista
1,4.5,Scott Spiegel,"Lee Batchler, Janet Scott Batchler","When her surrogate father who owns the casino she works in gets murdered, Modesty Blaise takes on those that killed him and are now at the casino to rob it. It turns out she is more than just a modest worker.",78,Mi nombre es Modesty: una aventura de Modesty Blaise
2,6.8,Shinji Takagi,Sadayuki Murai,"En la Gran Bretaña de 1860, un niño inventor se encuentra atrapado en medio de un conflicto mortal por un avance revolucionario en la energía del vapor.",126,Steamboy
3,7.4,Rajkumar Santoshi,Ranjit Kapoor,A team of police force escorts an alleged terrorist from Chandangarh to Mumbai. However their trip turns into a deadly survival when an ex-cop tries to stop them to reach Mumbai.,174,Khakee
4,5.3,Clive Morris,Clive Morris,No tiene argumento,No tiene datos,A Case of Murder
5,7.0,Farah Khan,Farah Khan,"An army major goes undercover as a college student. His mission is both professional and personal: to protect his general's daughter from a radical militant, and to find his estranged half-brother.",182,Main Hoon Na
6,3.0,Alle Segretti,"Alle Segretti, Zanne Segretti","He told them, get out of our lives in the next ten minutes or I will be in yours forever after. They chose option two. Now he is on a mission to annihilate the threat they have become.",120,Not About AJ
7,5.1,Pankaj Parashar,Rajiv Babbar,"Assistant Commissioner of Police, Uday Dhirendra Thakur, is a rogue cop, known for his relentlessness in pursuing criminals, and bringing them to justice, failing which, killing them in false encounters. It is this reputation that gets him transferred to crime detection, and counseling at the hands of Dr. Mehak. Then a series of homicides take place, and the police fe... Leer todo",127,Inteqam: The Perfect Game
8,4.9,David Carson,Tom Vaughan,"Dean has PTSD after a wet-job gone bad in Bosnia. Waiting for his police girlfriend at a diner, some bad guys inject him with a hallucinogen. It sends him back to traumatic experiences in Bosnia and he reacts violently.",96,Ladrones de mentes
9,6.3,Antoine Fuqua,David Franzoni,Una visión desmitificada de la historia del rey Arturo y los caballeros de la mesa redonda.,126,El rey Arturo
10,6.5,Jay Russell,Lewis Colick,"Como miembro de una hermandad de bomberos, Jack Morrison pasa de ser un novaro inexperto a un curtido veterano cuando se enfrenta a un trabajo muy peligrosos que lo convierte en un héroe pero que hace que engañe a su mujer y sus hijos.",115,Brigada 49
11,4.9,Kjell Sundvall,"Karin Alvtegen-Lundberg, Stefan Sauk, Ken Lindberg","A programmer who's working with the secret EWS computer system at a military air force base is threaten by foreign agents, along with his family. His only chance of rescue seems to be the war veteran Haglund who is a leader of a special taskforce.",103,La amenaza
12,2.8,Andrew Prendergast,"Alan Coulson, Jason Kingsley, Paul Mackman","A cleaning fluid experiment on an oil rig turns disastrous when a worker goes missing and eco-activists seize the rig, before a dangerous new creature forces workers and activists to band together.",93,Parasite
13,3.2,mink,Kantz,"Joshua Pope (Busta Rhymes) returns to his childhood home to claim the inheritance his late father has left him only to find that the local police have turned the town upside down and are ruling with an iron fist. So, with the help of an old friend (Xzibit) and his cohorts,Pope sets out to reclaim the town he once loved...by any means necessary. Tounge and cheek 70's s... Leer todo",95,Full Clip
14,6.3,Kevin Bray,Mort Briskin,"Un antiguo soldado estadounidense regresa a su ciudad natal para encontrarla invadida por el crimen y la corrupción, lo que le obligará a limpiar las calles de delincuentes.",86,Pisando fuerte
15,5.6,Ernest R. Dickerson,Donald Goines,A drug kingpin's return home touches off a turf war.,88,Nunca mueras solo
16,2.0,Ryan Combs,Ryan Combs,"This offbeat dark comedy take place when four friends (Brisco, J Rob, Pedro, and Hay Love) have a backyard bar-b-q and decide to come up on some bud. Not knowing where to turn, because the streets have been dry for a few months, they end up scoring from the son of a over protective mob figure by the name of Fredrico, who vows, if anything should happen to his son, the... Leer todo",90,I Accidentally Domed Your Son
17,5.8,Veera Shankar,"Pawan Kalyan, Satyanand","Shankar aka Gudumba Shankar, a petty-thief, falls in love with Gowri. When Shankar learns that Gowri and her family are harassed by powerful goon Kumaraswamy, he sets up a plot to fool kumaraswamy.",176,Gudumba Shankar
18,4.3,Gary Brockette,"Steven Chase, Howard Flamm","Ryan and Pete are 27-year old best friends in Miami, born on the same day and each searching for the perfect woman. Ryan is a rookie stockbroker living with his psychic Mom. Pete is a slick surfer dude yet to find commitment. Each meets the women of their dreams on the same day. Ryan knocks heads in an elevator with the gorgeous Jessica, passing out before getting her... Leer todo",101,Shut Up and Kiss Me!
19,5.4,Frédéric Schoendoerffer,"Yann Brion, Jean Cosmos, Olivier Douyère",Una amenaza podría frustrar el plan de un equipo de agentes secretos.,109,Agentes secretos
20,5.1,Jingle Ma,Susan Chan,"Lulu Wong lives a double life - part urban social butterfly, part vigilante superhero. Armed with ancient fighting techniques and high tech hardware, Lulu is a beautiful masked millionaire battling to defeat a greedy tyrant.",99,Fei Ying
21,4.5,Kevin Allen,Jeffrey Jurgensen,"Un astuto agente de la CIA ha robado al Gobierno de los Estados Unidos un dispositivo de control mental de alto secreto. Con la seguridad mundial en peligro, Cody debe desplazarse de incógnito a Londres para recuperarlo.",100,Superagente Cody Banks 2: Destino Londres
22,5.8,David S. Goyer,David S. Goyer,"Blade, ahora un hombre buscado por el FBI, debe unir fuerzas con los Nightstalkers para enfrentarse a su enemigo más desafiante hasta ahora: Drácula.",113,Blade: Trinity
23,6.5,David Mamet,David Mamet,La investigación del secuestro de la hija de un alto funcionario del gobierno de los Estados Unidos.,106,Spartan
24,4.7,Anthony Hickox,Steven E. de Souza,A terrorist posing as environmentalist hijacks an oil rig off the coast of California with the intent of detonating an electromagnetic bomb over the US.,92,Blast
25,3.3,Christoph Schrewe,"Torsten Dewi, Christoph Schrewe","After a meteor strike starts a new ice age, a group of survivors tries to find a device that could give mankind new hope",95,El día después del impacto
26,7.2,Wes Anderson,Wes Anderson,"El oceanógrafo Steve Zissou reúne a una tripulación que incluye a su mujer, a un periodista, y a un hombre que puede que sea su hijo, para dar caza al mítico tiburón que mató a su compañero.",119,Life Aquatic
27,5.8,Madhur Bhandarkar,"Hriday Lani, Sanjeev Puri, Manoj Tyagi",DCP Patnaik and his team's fights against corrupted politicians and mafia rule Mumbai city. However their faith in law and order is tested with serious outcomes.,149,Aan: Men at Work
28,5.2,Anthony J. Christopher,David Lee Rawlings,"Small-town retired sheriff Frank Everly finds his life on the skids after his wife Mary is murdered by the ruthless maniac Vincent Pope. When Pope escapes from prison, Everly comes out of retirement to hunt down Mary's killer. The search for Pope soon turns into a twisted game of cat and mouse. Pumping with heart-racing action, this modern-day western will take the au... Leer todo",86,Day of Redemption
29,7.3,Zack Snyder,George A. Romero,"Una enfermera, un policía, un joven matrimonio, un vendedor y otros supervivientes de una plaga mundial que está produciendo zombis agresivos y carnívoros, se refugian en un megacentro comercial.",101,Amanecer de los muertos
30,4.7,Sanjeev Puri,"Sanjeev Puri, Manoj Tyagi","Based on the true story of Air Force personnel in Srinagar, Kashmir.",No tiene datos,Agni Pankh
31,4.4,Hriday Shetty,"Yash Gawli, Sanjay Gupta, Yash Keswani","To pay off their gambling debt, four best friends kidnap an organized crime figure having mistaken him for a wealthy businessman.",149,Plan
32,3.6,Jamel Aattache,"Jamel Aattache, Kim Ho Kim","Fighting Fish is the first martial arts film produced and set in the Netherlands, about a young Chinese man from Hong-Kong, who travels to the west when he hears that his brother was killed during fight between two gangs in Rotterdam. When he arrives he immediately puts his raging fists to use when he tries to take revenge on the gang that killed his brother. But soon... Leer todo",90,Fighting Fish
33,6.5,Jean-François Laguionie,"Jean-François Laguionie, Anik Leray","Kid, a 15-year-old hard laborer, steals a map that promises to reveal the location of the notorious pirate Black Mor's treasure. Together with his crew -- MacGregor, Beanpole, Taka and Jim the monkey -- Kid procures a vessel and sets out to sea.",85,L'île de Black Mór
34,8.4,Kamal Haasan,H. Banerjee,A temperamental farmer gets embroiled in a bloody clan feud in a southern Tamil Nadu village.,175,Virumandi
35,4.6,Joseph Friel,Joseph Friel,Bill Taylor wakes up to find that someone has planted a bomb inside his body. He must do everything the mysterious caller demands before time runs out.,82,The Ticking Man
36,3.4,Kevin O'Neill,Dan Acre,"After an African dinosaur ancestor of the crocodile is found, Dr. Campbell uses its DNA to create prototypes at Paula Kennedy's Gereco lab.",90,Dinocroc
37,No tiene datos,Ryan McKinney,"Ryan Mc, Kinney",No tiene argumento,No tiene datos,Simple & Safe
38,6.2,Brett Ratner,Paul Zbyszewski,Un ladrón que logra su último gran robo está a punto de ser capturado por el agente del F.B.I que le prometió que lo haría.,97,El gran golpe
39,5.5,Philippe Martinez,"Mick Davis, Laurent Fellous, Kristina Hamilton-Grobler","Después de que su esposa sea brutalmente asesinada, Ben Archer, ejecutor de una organización criminal retirado, emprende una guerra contra las tríadas chinas.",91,Justa venganza
40,2.7,William Webb,Jim Makichuk,U.S. Army sniper Charlie Snow finds himself at the other end of the crosshairs when the brother of an Eastern European arms dealer whom he killed decides to take vengeance on Charlie and his family in L.A.,84,Target (El desafío)
41,5.4,Angela Robinson,Angela Robinson,"Las colegialas con falda escocesa son preparadas por una agencia secreta del gobierno para convertirse en los miembros más nuevos del grupo de defensa nacional de élite, D.E.B.S.",91,D.E.B.S. - espías en acción
42,5.0,Read Ridley,Read Ridley,"A Chicago Detective goes to the lawless, forgotten hood of ""Dodge City"" in Nashville, TN to avenge a death and crush the local gangsta syndicate run by Mr. T-Ball Williams.",98,Dodge City: A Spaghetto Western
43,6.9,Neil Widener,Neil Widener,"Genesee is tired of spending everyday fishing in her neighborhood with her three best friends--Patton, Chris, and Stock Exchange. She wants an adventure! Her wish is granted when the crew stumbles upon an Indian arrowhead that magically levitates, pointing to an unseen target. The gang decides to follow the mysterious 'compass,' unaware that it carries an ancient curs... Leer todo",70,"Subdivision, Colorado"
44,4.7,Dwight H. Little,Hans Bauer,"Una expedición científica parte en Borneo para encontrar la Orquídea Sangrienta, que ofrece longevidad, pero descubren que un nido de anacondas la encontró primero.",97,Anacondas: La cacería por la orquídea sangrienta
45,2.7,Mani Shankar,Mani Shankar,"A doctor travels from America to India to investigate a man with paranormal healing powers, and uncovers the existence of a dark power that has the potential to transform humans into a new species.",143,Rudraksh
46,5.0,Sidney J. Furie,Greg Mellott,"Frank Gannon, a veteran cop, is being hunted by his fellow police officers after they learned he has betrayed the brotherhood and exposed to the feds wide scale corruption of the LAPD. He has one day left to prove his case and survive.",97,Direct Action
47,4.7,Conor McMahon,"Conor Mc, Mahon","An infection spreads from slaughtered animals to humans, which causes the dead to rise and feed on the living.",80,Carne muerta
48,6.9,Jon Turteltaub,Jim Kouf,Un historiador se esfuerza por encontrar el legendario tesoro de los templarios antes de que un equipo de mercenarios lo encuentre primero.,131,La búsqueda (National Treasure)
49,3.8,Rajiv Rai,"Rajiv Rai, Naeem Sha","When the President of India is kidnapped by Kashmiri terrorists in Locarno, Switzerland, an Indian secret agent is sent to find him and set him free. With the help of an Indian singer he will make the ""Impossible"" to complete the mission.",139,Asambhav
50,5.7,Paul W.S. Anderson,Dan O'Bannon,"Durante una expedición arqueológica en la isla Bouvet, en la Antártida, un equipo de arqueólogos y otros científicos se ven envueltos en una batalla entre dos leyendas. Pronto, el equipo se da cuenta de que solo una especie puede ganar.",101,Alien vs. Predator
51,4.5,Azhagam Perumal,"Azhagam Perumal, Sujatha","Udhaya and Vasanthi love each other, but when he learns that she is engaged to another, he moves to another city. Here he is framed for a crime; Vasanthi finds out and sets out to prove his innocence.",122,Udhaya
52,7.5,Michael Mann,Stuart Beattie,Un conductor de taxi se encuentra a sí mismo como el rehén de un asesino a sueldo comprometido cuando realiza una ronda de golpe a golpe durante una noche en Los Ángeles.,120,Collateral
53,2.5,Jeff Celentano,"Alexander Nevsky, Robert Madrid","A retired diplomat and an LAPD detective seek justice, by pursuing a psychotic killer to Moscow. With the help of a Moscow police, they weave their way through labyrinth of the Russian underworld as time is running out.",90,Moscow Heat
54,5.6,Michael Heimark,"Michael Heimark, Jakob Mikkelsen",No tiene argumento,No tiene datos,Den sidste dag
55,8.1,Iren Koster,Iren KosterTracey Silvers,No tiene datos,No tiene datos,Invisible Kids
56,No tiene datos,Ninan Kurien,Greg Freitas,"Every year, 300 riders set out from Paris to travel across 5,000 miles of breath-taking African sands in a race followed by several hundred millkion passionate fans all over the world. The 18-day race is the ultimate test of man and machine's attempt to conquer nature.",No tiene datos,The Last Road Trip
57,3.3,Richard Jobson,Richard Jobson,"The story of martial arts clubs who have created their own city infrastructure after tiring of government initiatives. Responding to the greed and corruption creeping into the other clubs, headed by capitalist-wannabe Moses, The Purifiers battle to maintain the successful system which has rid the city of crime and violence.",85,The Purifiers
58,6.5,Jonathan Jakubowicz,Jonathan Jakubowicz,Young couple Carla (Maestro) and Martin (Leroux) are abducted by three men and spend a terrifying night in Caracas as they wait for Carla's father (Blades) to hand over the ransom.,90,Secuestro express
59,7.7,Stephen Chow,Stephen Chow,"En Shangai, China, en la década de 1940, un aspirante a gánster quiere unirse a la famosa «Axe Gang», pero los aparentemente inofensivos vecinos de un complejo de viviendas no son lo que parecen.",99,Kung Fu sion
60,7.7,Paul Greengrass,Robert Ludlum,Jason Bourne es incriminado en el fracaso de una operación de la CIA y se ve obligado a reanudar su vida como asesino profesional para sobrevivir.,108,El mito de Bourne
61,7.2,Trey Parker,Trey Parker,"El popular actor de Broadway Gary Johnston es reclutado por la organización de élite antiterrorista Team America. A medida que el mundo se desmorona a su alrededor, debe luchar contra los terroristas, las celebridades y enamorarse.",98,Team America: La policía del mundo
62,No tiene datos,No tiene datos,No tiene datos,No tiene datos,No tiene datos,No tiene datos
63,No tiene datos,Michael Kallio,Michael Kallio,No tiene datos,90,Memory Lapse
64,3.1,Brian Yuzna,"Alberto Vázquez Figueroa, Miguel Tejada-Flores","Dante travels across a desolate, futuristic Spain in search of his girlfriend, Ula. He is pursued by a bloodthirsty, cybernetic Rottweiler.",95,Rottweiler
65,6.4,Aleksi Mäkelä,"Pekka Lehtosaari, Reijo Mäki","On the trail of a woman, Vares finds himself caught up with underworld characters who are on the trail of hidden millions.",95,Vares - yksityisetsivä
66,5.4,Jean-Paul Salomé,"Jean-Paul SaloméLaurent Vachaud, Maurice Leblanc","Mientras el intrépido ladrón Arsène Lupin saquea las casas de los ricos parisinos, la Policía, con un arma secreta en su arsenal, intenta descubrirlo.",125,Arsène Lupin
67,3.9,Hiroyuki Nasu,"Gô Nagai, Machiko Nasu","Based on Gô Nagai's manga, about mild-mannered teenager Akira Fudô, who merges with a demon to fight other demons.",116,Devilman
68,5.5,Dante Lam,"Kin Chung Chan, Hing-Ka Chan","(Cantonese with English subtitles) Hotshot police officers Aaron Kwok and Eason Chan are both full of talent and ego. So when their boss decides to put them both together on a ""special"" project, all they do is bicker. Before long, they're put to the test as a duo when a dangerous jewelry thief manages to disappear with plenty of loot. Will the two keep their egos in c... Leer todo",99,Chung on chi ma Gun
69,3.4,Ken Barbet,David Neilsen,"An ex-Navy SEAL faces his riskiest mission yet when he's forced to compete for his life in a survival game. The last man standing will take home a 10 million dollar prize, those who fail will die a lonely death in the jungle.",90,The Eliminator
70,7.9,Mani Ratnam,Mani Ratnam,Three men and their accidental meeting on Napier Bridge will change their lives forever.,160,Aayitha Ezhuthu
71,3.5,Frédéric Auburtin,"Frédéric Dard, Laurent Touil-Tartour","While a terrorist epidemic strikes the world leaders, the commissaire San-Antonio and his partner Lieutenant Bérurier must escort the French ambassador to a British hotel. But after a negligence of Bérurier (one more little sex affair), San-Antonio powerlessly witnesses the ambassador's abduction, organized by a gorgeous Italian girl. Back in Paris, San-Antonio is dis... Leer todo",95,San Antonio
72,6.2,Tim Hunter,Todd Slavkin,A sociopath on death row is given a chance to live if he agrees to take part in a chemical behavioral modification program.,104,Asesino
73,4.0,Gérard Pirès,"Alexandre Coquelle, Matthieu Le Naour",Two spies are undercover to track down a nuclear missile while distracting a vilain trying to get world's domination,90,Espías súper secretos
74,4.3,Bryan Goeres,"Diane Fine, Evan Spiliotopoulos","When a painting owned by one of her clients is stolen from a Barcelona museum, a New York-based artexpert is sent there to help investigate. After more paintings are stolen, she learns that she is being framed for the crimes. With the help of her estranged husband, a New York cop, they must not only solve the crimes but clear her name.",98,Golpe maestro
75,7.1,Andrea Costantini,Andrea Costantini,"Superintendent Chessari is sent to run a small police station on the outskirts of Rome - a temporary posting in a difficult area, with not much backing and very few staff. His deputy, Lorenzo Corsi, is a youngster just out of the Academy, full of enthusiasm and high principles which clash with the corrupt reality of the streets and the attitude of his colleagues. The ... Leer todo",No tiene datos,Dentro la città
76,7.3,Matthew Vaughn,J.J. Connolly,Un exitoso traficante de cocaína recibe dos tareas difíciles de su jefe en la víspera de lo que debería ser su jubilación anticipada.,105,Layer Cake: Crimen organizado
77,8.0,Quentin Tarantino,Quentin Tarantino,"La novia continúa su búsqueda de venganza contra su antiguo jefe y amante Bill, el solitario portero Budd y la traicionera Elle, tuerta.",137,Kill Bill: Volumen 2
78,4.7,Vikram Bhatt,"Robin Bhatt, Vikram Bhatt, Girish Dhamija","A protective father starts digging deeper into the past of his daughter's possessive, unpredictable and violent boyfriend.",152,Aetbaar
79,6.0,Takashi Miike,Shigenori Takechi,"An executed samurai takes an existential journey throughout time, space and eternity in search of bloody vengeance.",128,Izo
80,6.1,John Moore,Lukas Heller,Los supervivientes de un accidente aéreo en el desierto de Mongolia trabajan juntos para construir un nuevo avión.,113,El vuelo del Fénix
81,3.4,Pappan,Dennis Joseph,"Vajram is a 2004 Indian Malayalam Flim, directed by Pramod Pappan & produced by Haksar Syed.The flim star Mammootty, Kousalya & Vasundhara Das in lead roles.The music of the film was composed by Ouseppachan & S. P. Venkatesh.",122,Vajram
82,4.6,Alki David,Alki David,Se cuenta la épica lucha de la apneísta Danai Varveri por convertirse en campeona del mundo.,95,The Freediver
83,6.6,Elia Schneider,Henry Herrera,"""Punto y raya"" is the story of a young Colombian recruit who, while patrolling his country's border, is befriended by a Venezuelan adversary, and the tragic consequences of their relationship.",105,Punto y raya
84,5.8,Alain Berbérian,Christian Clavier,"Rémi François es un detective contratado para buscar a Ange Leoni, un corso que al parecer ha heredado una casa de 2 millones de euros.",92,El archivo corso
85,6.1,Puneet Sira,"Vekeana Dhillon, Puneet Sira",I is an Indian. He travels to London for a family wedding and finds his family live in fear of the terrorism by National Front Skinheads and finds he has to become involved which escalates the situation.,129,I - Proud to Be an Indian
86,7.4,Alejandro Lozano,Tony Dalton,Una comedia oscura y poco convencional sobre un grupo de adolescentes de la Ciudad de México envueltos en un secuestro que involucra a una leyenda de lucha libre retirada y un loro.,99,Matando Cabos
87,4.6,Jean van de Velde,Gerard Soeteman,"Floris van Rozemond Junior, son and heir of a long line of knights of that name, refuses to go in the military 'family business' and becomes an actor, a profession scorned by his homonymous father, the general of the under-age duke of Burgundy. The duke chose this year to pay for his people to have bread and butter, rather then canons for the army, but relies for Flor... Leer todo",100,Floris
88,7.3,Mani Ratnam,Anurag Kashyap,"Michael, Arjun and Lallan, three men from three different strata of society, cross paths one morning in Calcutta and change one another's lives forever.",161,Yuva
89,5.1,Ari Taub,"Nick Day, Caio Ribeiro",The story of ordinary men during WWII as seen from three different points of View.,112,Días de sangre y fuego
90,5.3,Conrad Glover,Conrad Glover,A young woman released from a drug rehab program commits a wrong act to further her dream only to find out it may cost her the lives of her friends and her own.,82,Bottom Out
91,7.5,Yimou Zhang,Feng Li,"Un romántico capitán de policía saca de la cárcel a una bella miembro de un grupo rebelde para ayudarla a reunirse con sus compañeros, pero las cosas no son lo que parecen.",119,La casa de las dagas voladoras
92,6.9,Benny Chan,Alan Yuen,"Un policía héroe lleva accidentalmente a su equipo a una trampa de la que él es el único superviviente. Ahogando su culpa en alcohol, le asignan un nuevo compañero más joven que resulta tener sus propios secretos.",123,New Police Story
93,3.1,Christopher Kulikowski,Christopher Kulikowski,Two time travelers with opposing views are sent back to the present aboard a research ship in the Antarctic to prevent a global biological disaster from occuring.,93,Commander
94,3.6,Richard Gabai,Michael Gannon,"Evan Hanson is the best motocross coach in the country. After leading his daughter Callie to the national championships, he decides to set his sights on a more personal challenge - saving a local dirt track from a motorcycle gang.",82,Motocross Kids
95,8.0,Kang Je-kyu,"Kang Je-kyu, Sang-don Kim, Han Ji-hoon","Cuando dos hermanos se ven obligados a luchar en la guerra de Corea, el mayor decide aceptar las misiones más arriesgadas para tratar de evitar que el menor se vea envuelto en la batalla.",140,Lazos de guerra
96,7.6,Chuan Lu,Chuan Lu,Una conmovedora historia real sobre voluntarios que protegen a los antílopes de los cazadores furtivos en las montañas del Tíbet.,85,La patrulla de la montaña
97,6.0,Milan Luthria,Anurag Kashyap,A group of Indian POW (Prisoners Of War) rebels against Pakistani army and tries to escape from their captivity during India-Pakistan war in 1971.,163,Deewaar: Let's Bring Our Heroes Home
98,4.6,Jakob Schäuffelen,"Axel Melzener, Jörn Precht, Frank Weiss",Young Mia is totally in love with cars and spends every free minute tinkering with her mother's old VW Beetle. Her big dream is to take part in the Paris-Dakar Rally someday.,86,Abgefahren
99,5.9,Han-jun Park,Won-jun Ha,Go-Bong has a huge crush on Gye-Soon who works at a fast food restaurant without knowing that the girl he love is a spy from North Korea.,102,Geunyeoreul moreumyeon gancheob
100,5.1,Marco Mak,"Kai-Cheung Chung, Derick Lau, Ask Lee","Rural kung fu whiz Qiang travels to visit his friend Lung, who's taken up Xanda, a new martial art that fuses multiple styles. When Lung is grievously wounded by the Xanda champ, Qiang trains in the sport to seek revenge in the ring.",92,Combate final
101,4.4,Nick Groff,"Nick Groff, Michael A. Martinez","Antonio owes the Robaldo family a hundred G's, Gray wants revenge on the street gang who mugged him, Jimmy's escaped from prison, and his brother/accomplice David has many serious mental conditions. Detective Brickley is hot on their trail willing to stop them with any means necessary, while a pair of rogue psychiatrists track them to discover the roots of David's con... Leer todo",127,Malevolence
