,0,1,2,3,4,5,6,7
695,2.2,No tiene datos,Dustin Haynes,Benjamin Cornelius,No tiene datos,No tiene datos,Comic Day,tt0373764
696,3.3,No tiene datos,Deepak Bahry,Saroj Khan,"Kumar is a businessman and lives in Simla with his pregnant wife, Laxmi, two sons, Raja and Ajay. Both Laxmi and he are delighted that they will soon be welcoming Komal, a daughter. Before her birth, Kumar comes to know that Ajay and the child she is carrying in her womb are not his, but of his employee, Sadashiv, who has killed himself and left a note implicating Lax... Leer todo",No tiene datos,Khanjar,tt0373970
697,7.8,No tiene datos,Prakash Jha,Prakash Jha,"An IPS officer motivates and leads a dysfunctional, corrupt police force of Tezpur to fight against the corrupt politician.",157,Gangaajal,tt0373856
698,5.2,No tiene datos,Oxide Chun Pang,Oxide Chun Pang,"A psychologist, an Englishman, a bellboy and a wounded female assassin have their fates crossed at a sleazy Bangkok hotel.",96,Tesseract,tt0374273
699,6.3,No tiene datos,Ping He,Richard Epcar,"Un emisario chino es enviado al desierto de Gobi para ejecutar a un soldado renegado. Sin embargo, cuando una caravana que transporta a un monje budista y un valioso tesoro es amenazada por ladrones, se unen para proteger a los viajeros.",120,Guerreros del cielo y la tierra,tt0374330
700,7.2,No tiene datos,Erik Van Looy,Jef Geeraerts,Vincke y Verstuyft son los mejores investigadores del departamento de policía de Antwerp. Se enfrentan al asesinato de un alto ejecutivo y ponen todo su esfuerzo en atrapar al asesino.,123,La memoria del asesino,tt0374345
701,6.6,No tiene datos,Johnnie To,"Ka-Fai Wai, Nai-Hoi Yau, Kin-Yee Au","A monk turned body-builder, with the gift to see into people's lives, befriends a female cop, and uses his gift to change the force of Karma and her destiny.",93,Dai zek lo,tt0374184
702,7.2,79,Satish Kaushik,Bala,"Problems arise when Radhey Mohan, a delinquent falls in love with a girl named Nirjara.",132,Tere Naam,tt0374271
703,6.8,No tiene datos,Andrew Lau,"Alan Mak, Felix Chong","Months after the events of the original film, Ming suspects a police superintendent as being a new mole for the triads, while years earlier, Yan embarks on his first mission.",118,Juego sucio 3,tt0374339
704,7.4,77,Puri Jagannadh,Kona Venkat,"A former kick-boxer, after death of his wife, trains his son who hates him for boxing match for revenge on his former student.",154,Amma Nanna O Tamila Ammayi,tt0374497
705,5.4,No tiene datos,Vikram Bhatt,Mahesh Bhatt,"Two friends of a man help him avenge his father's death. Years later, he reunites with his friends who have now become criminals. What they don't know, is that he is now an undercover cop.",164,Footpath,tt0374660
706,No tiene datos,No tiene datos,Benny Chi-Shun Chan,Robert ChanWilson Tong,No tiene datos,No tiene datos,Counter Attack 2,tt0375656
707,5.2,No tiene datos,Minh Chieu,Minh Chieu,No tiene datos,No tiene datos,Cycle,tt0374594
708,7.3,No tiene datos,S.S. Rajamouli,"Vijayendra Prasad, S.S. Rajamouli, Gangothri Viswanath","Simhadri, a loyal servant in a landlord's house, also leads a secret life as Singamalai, a powerful leader in the state of Kerala.",170,Simhadri,tt0375066
709,No tiene datos,No tiene datos,Willy Milan,"Willy Milan, Marlon Rivero",No tiene argumento,100,Masamang ugat,tt0375958
710,8.0,92,Gautham Vasudev Menon,Morgan Anthony,"Después de que un equipo policial mate a su hermano, un gángster narcotraficante promete matar a todo el equipo y a sus respectivas familias.",153,Kaakha Kaakha,tt0375878
711,No tiene datos,No tiene datos,Chico Ejiro,Damijo Efe YoungOsita Okoli,No tiene datos,No tiene datos,Computer Girls,tt0375671
712,5.7,No tiene datos,Byung-chun Min,"Philip K. Dick, Han Jae-rim, Byung-chun Min","In the near future, humans rely heavily on androids to maintain society, but some of the machines revolt. A military officer in charge of doing away with the unruly cyborgs also loves the gynoid that looks over him.",114,Naechureol siti,tt0378428
713,4.4,No tiene datos,Siva Akula,"Krishna Murali Posani, Siva Akula",No tiene argumento,No tiene datos,Simhachalam,tt0377133
714,5.3,No tiene datos,Lal Jose,Reji Nair,"Deals with sweet,funny&hillarious incidents that takes place in a village when a miltry squards tend in a village as a report of terrorist attack.",159,Pattalam,tt0376061
715,6.5,No tiene datos,Marco Mak,Jing Wong,"A man becomes a cop in order to take down the police superintendent who may have killed his father, and that of a vengeful Triad boss.",104,Hak bak sam lam,tt0375669
716,7.3,No tiene datos,Hari,"Hari, Mayank Jain",A cop takes bribes from politicians and goons. He rethinks his life choices after he meets a girl.,150,Saamy,tt0376144
717,8.3,80,Bala,Bala,"Chittan, a social outcast, has grown up in a cemetery. A drug dealer finds him a job in a cannabis farm. In prison, he meets a conman, Shakti. This friendship transforms him from his stony existence.",139,Pithamagan,tt0376076
718,5.1,No tiene datos,Daniel Lee,Yin-Han Chow,"Get ready for the ultimate martial arts competition, where anything goes and lives are bought and sold. Tank is the celebrated Champion Star Runner and is deemed invincible among the martial arts community. When the headstrong Bond becomes determined to take on the undefeated fighter, he knows he must be in the best fighting condition. Training under a renowned martia... Leer todo",103,Siu nin a Fu,tt0378773
719,7.1,No tiene datos,William Minsky,Dana AndersonKevin GilleseWilliam Minsky,No tiene datos,81,Purple Gas,tt0376839
720,5.9,No tiene datos,Katsuyuki Motohiro,Ryôichi Kimizuka,"A special investigative team takes on a strange murder case. As they trace the killer, another murder happens and a witness shows up, making things even more confusing.",138,Odoru daisosasen the movie 2: Rainbow Bridge wo fuusa seyo!,tt0378475
721,7.2,No tiene datos,M. Salim,Sheeba AgarwalSadashiv AmrapurkarLiyaqat Bari,No tiene datos,No tiene datos,Basti,tt0377126
722,8.0,No tiene datos,Johny Antony,"Siby K. Thomas, Udaykrishnan","The adventures of a private detective, Moosa, whose luck and wit help him to solve the cases.",160,C.I.D. Moosa,tt0377575
723,5.8,No tiene datos,Kwang-hoon Lee,"Ju-ri Hong, Sngmoo Lee","A thousand years ago, an evil spirit was kept imprisoned in a lake by the first emperor of the Chilla empire. Now unleashed, it possesses the body of Ja Woon-bi, the wife of general Biharang, with the aim to bring down the very dynasty that destroyed his people. Biharang is torn; to kill the spirit, he has to also kill his wife.",92,La leyenda del lago maldito,tt0377633
724,6.8,No tiene datos,Jayaraj,"Raffi, Meccartin, Alankodu Leelakrishnan","Long-lost 'Unni' returns after a long span of time, though mentally challenged. Several attempts are made by his family and villagers, to recover his mental illness. But some unexpected incidents, form the plot.",No tiene datos,Thilakkam,tt0378873
725,5.2,No tiene datos,Sisir. P. Mishra,"Miraq Mirza, Pyarelal Sharma","Balraj live a simple life with his parents and two brothers Inspector Ajay and, Uday.But his father got killed by the Kallal gang and Balraj joins hand with a gangster Bitthal Rao.Ajay goes against him for joining the underworld.But Uday supports his decision and wants to end the Kallal gang.",154,Tada,tt0380017
726,4.7,No tiene datos,Higuchinsky,Higuchinsky,"A group of eleven criminals are trapped in a warehouse with bracelets. The eleven learn that they are part of a game where the prize is three million Yen and a clean record. The object is to reach the Baron's house. However, the obstacles they face involve hunters with laser guns who will go after the contestants. It seems as if this game is fun...however, the game pr... Leer todo",70,Tokyo 10+01,tt0380027
727,6.5,No tiene datos,Y.V.S. Chowdary,Y.V.S. Chowdary,"Seetayya(Hari krishna),a sincere cop with a painful past goes against a powerful faction leader to stop his acts.",No tiene datos,Seetayya,tt0379488
728,6.1,No tiene datos,Juan Martínez Moreno,Juan Martínez Moreno,"Nothing is simple in the life of crime. Paco is a failed hit man and he owes important money to Don Rodrigo, the main gangster in town who offers him two options: one is to kill him and the other is almost worse. You won't believe the outcome. Paco es un maton a sueldo lleno de deudas y le debe plata a Don Rodrigo, el gangster mas importante de la ciudad. Este le ofre... Leer todo",99,Dos tipos duros,tt0380323
729,6.4,No tiene datos,Éric Tessier,Patrick SenécalÉric Tessier,"In Montreal, on the same day that a policeman shot eleven children, killing ten, without any reason, the successful writer Thomas Roy amputates his fingers and tries to commit suicide. Completely catatonic, he is treated by Dr. Paul Lacasse and his big fan, the pregnant Dr. Jeanne Marcoux, in a psychiatric hospital. When the journalist Charles Monette, who is writing ... Leer todo",97,Sur le seuil,tt0380732
730,6.7,No tiene datos,Patricio Ginelsa,Patricio Ginelsa,"LUMPIA takes you back to the late-90's when tension is at an all-time high in Fogtown High School. James and his friends become the targets of ridicule for the CREW, a bunch of thugs who have invented a new fad of (gulp!) F.O.B. bashing! But only one thing stands in their way... LUMPIA!",80,Lumpia,tt0380512
731,6.7,36,Philip Boston,Ken Bradshaw,"Action sports documentary that follows the industry's best big wave surfers as they travel the world searching for the largest waves that nature has to offer. The journey spanned 18 months, 6 continents and produced up to 70 foot waves.",88,Billabong Odyssey,tt0379713
732,5.8,No tiene datos,Benny Chan,"Alan Yuen, Adrian Kwan","Tough cop Ken is investigating why a model officer was caught committing a crime in the police station. He soon determines that the officer was under a mesmeric influence, and recruits a noted hypnotist currently serving a prison sentence.",100,Seung hung,tt0379985
733,5.4,39,Rohit Shetty,"Robin Bhatt, Javed Siddiqui, Suparn Varma","Colonel Ranvir and ACP Jaideep joins forces to fight against Pakistani terrorists, who hijacks an Indian airplane and demands to free their militant leader in return.",154,Zameen,tt0382385
734,5.8,53,Bill Giggie,Brent Piaskoski,The Rescue Heroes face their biggest challenge yet as a series of freak lightning storms begin to wreak havoc worldwide.,2003,Rescue Heroes: The Movie,tt0382942
735,5.6,62,Daniel Casey,Daniel Casey,An former small-crimes convict is offered a chance at revenge by participating in a risky robbery.,77,The Passage,tt0382896
736,3.8,No tiene datos,László Szabó,László Szabó,No tiene argumento,103,"Az ember, aki nappal aludt",tt0382664
737,4.7,85,Swapan Saha,"Mithun Chakraborty, Kaushik Banerjee, Rachana Banerjee",Un hombre de clase trabajadora de buen carácter lucha para ayudar a sus hermanos a progresar en el mundo y protegerlos de las malas intenciones de sus enemigos gánsteres.,162,Guru,tt0383386
738,7.0,No tiene datos,Kitarô Kôsaka,"Iou Kuroda, Kitarô Kôsaka",Follows the struggle of a Spanish professional cyclist to win a bike race the same day of his brother's wedding.,47,Nasu: Andalusia no natsu,tt0382868
739,4.1,No tiene datos,Desmond Gumbs,"La, Nease Adams","Julius, a young man who has his eyes set on becoming a famous deejay like Bob Marley, is desperate for a chance to go to L.A. and further his music career. Julius agrees to become a drug mule for Jamaican Crime lord Crown and his henchman Gargon in exchange for a passport and visa. Once in L.A. and trying to go straight Julius is still struggling and excepts a job as ... Leer todo",90,Rude Boy: The Jamaican Don,tt0383607
740,6.7,47,Ryûhei Kitamura,"Yû Koyama, Mataichirô Yamamoto, Isao Kiriyama","Raised to deal in cold blooded death, the teenage assassin girl Azumi must defeat three evil warlords while also battling her own heart.",128,Azumi,tt0384819
741,4.4,No tiene datos,JK Youn,JK Youn,"During a kidnapping plot, a group of hapless assassins disturb some ghosts who take pity on then and lend them their supernatural martial arts skills.",98,Nangman jagaek,tt0385115
742,6.0,No tiene datos,Yôjirô Takita,"Itaru Era, Yôjirô Takita, Baku Yumemakura",A group of demons in the ancient Japanese capital of Heian is dismembering members of a family of Japanese nobles.,112,Onmyoji 2,tt0383543
743,4.5,No tiene datos,Shaji Kailas,"Gopalakrishna Paruchuri, Paruchuri Venkateswara Rao","Vishnu and Vaishnavi are childhood pals. They get separated at a young age. After a gap of 15 years, Vishnu finds Vaishnavi. He does not disclose his identity and instead to win her love on his own merits. Vaishnavi learns of this and a misunderstandings crop up.",180,Vishnu,tt0383702
744,5.2,No tiene datos,Yogesh Bhardwaj,"Faisal Khan, Rajat Bedi, Aditya Pancholi","This sprawling epic centers on the romance between star-crossed lovers Nargis and Raj, whose love blossoms in the face of a brutal war.",150,Border Hindustan Ka,tt0385564
745,6.8,No tiene datos,Jaspreet Singh Grewal,Jaspreet Singh Grewal,Two London geezers rip off a stash of H and get more than they bargained for!,80,"Give and Take, and Take",tt0384134
746,5.3,No tiene datos,Vikram Bhatt,"Mahesh Bhatt, Girish Dhamija","Tina Saxena lives a wealthy life-style with her widowed businessman dad. One day, all of a sudden, she gets a nasty shock when her dad informs her that he had a mistress before he was married to her mother, and that this affair had resulted in the birth of a daughter, Nandini. Much to Tina's distaste, he invites Nandini to live with them, and asks her to look after Ti... Leer todo",155,Inteha,tt0385782
747,6.5,No tiene datos,Bratya Basu,"Amitabh Bhattacharjee, Mithun Chakraborty, Soma Dey",No tiene argumento,110,Raasta,tt0385977
748,4.8,No tiene datos,Ravi Raja,Kona Venkat,"Yedu is a responsible citizen of Bobbarlanka, a place where everything is in place but for the polluted water that is coming from the factory. Everybody in the village complained, but of no use. Then the village head forms a team of three comprising of Yedu, Manga and her grandmother and sends them to Hyderabad so that they could meet the minister and express the vill... Leer todo",180,Veede,tt0386102
749,5.6,No tiene datos,Seiji Chiba,Seiji Chiba,No tiene datos,77,Ganryujima,tt0385715
750,5.7,No tiene datos,Yûdai Yamaguchi,"Isao Kiriyama, Gatarô Man, Ryûichi Takatsu","Battlefield Baseball is a tough game--it doesn't end until all the members on the opposing team are dead. In this game the Gedo High team is composed of blue-faced zombies, and their opponents on the Seido High team know they don't have a chance at beating them unless they can bring back a star pitcher who has a lethal pitch called the Super Tornado, but who has hung ... Leer todo",87,Battlefield Baseball,tt0384832
751,6.1,56,Puri Jagannadh,"Puri Jagannadh, Kona Venkat",An ex cop goes in search of his lost girlfriend to Kerala and along way meets a news reporter who helps him to find his lover.,143,Shivamani,tt0386029
752,No tiene datos,No tiene datos,Guillermo Jaime Alarid,"Luz Elena González, Joaquín Cordero, Valeria Palmer",No tiene argumento,83,Doble secuestro,tt0387172
753,No tiene datos,No tiene datos,Agustín Bernal,No tiene datos,No tiene argumento,90,"Tianguis, ratas de la ciudad",tt0387633
754,No tiene datos,No tiene datos,Ruben Gutierrez,No tiene datos,No tiene argumento,85,El corrido de Valente Quintero,tt0387147
755,7.0,84,Kang Woo-suk,Hie-jae Kim,Based on a true story of 1968 Korean Republic Army plan to assassinate North Korean president Kim Il-Sung. 31 criminals and death row inmates are recruited into secret training on the island of Silmi; for two years they are subjected to maximum mental and physical abuse before the mission is cancelled and the unit terminated.,135,Silmido,tt0387596
756,4.6,No tiene datos,Carlo J. Caparas,Chavit SingsonCarlo J. Caparas,No tiene datos,No tiene datos,Chavit,tt0387923
757,6.3,No tiene datos,Steven Rumbelow,Steven Rumbelow,No tiene argumento,No tiene datos,Queen City Blowout,tt0388357
758,4.3,68,Neil Taylor,"Neil Taylor, Rob Taylor","Tough-as-nails adventurer, Neil Stryker, faces immeasurable odds in this madcap comedy bloodbath when he comes face to face with an EVIL CULT! Armed with a bag of tricks, Stryker unleashes the pain on Walter, the cult leader, and his brainwashed followers.",90,Evil Cult,tt0389989
759,No tiene datos,No tiene datos,Agustín Bernal,No tiene datos,No tiene argumento,No tiene datos,El fin de los Arellano,tt0390004
760,6.6,No tiene datos,Elart Coello,Mario Ramirez Reyes,No tiene argumento,90,Al infierno con la migra,tt0391734
761,2.7,No tiene datos,Shunichi Kajima,Hiroshi Katsuwabara,No tiene datos,85,Pureigâru,tt0390373
762,4.2,No tiene datos,Bhadran,Bhadran,"Raj and his friends go to a remote village and start a touring talkie that shows scenes from Rajinikanth's movies. He falls in love with a local girl, but his past surfaces and changes their lives.",No tiene datos,Vellithira,tt0390597
763,2.6,50,Moacyr Góes,Flávio de Souza,"Sofia goes to her cousin Matheus' to take care of his two children, Júlia and Lucas, while he goes to a party. She finds a magic book that transports them to a Magic Forest where they meet fairytale characters like Pinocchio and Little Red Riding Hood. But their presence starts to interfere with the original stories, so Matheus tries to return them to the real world.",87,Xuxa Abracadabra,tt0391726
764,2.4,No tiene datos,Vinayan,"Vinayan, J. Pallassery","Captain Gopinath, along with Serina, the daughter of a Pakistani army general, must derail Pakistan's plans of using a nuclear bomb against India in the wake of their lost war.",No tiene datos,War & Love,tt0389522
765,8.0,No tiene datos,Robin Brennan,"Robin Brennan, Paul Moder, David Richardson","After a robbery gone wrong, three criminals turn against each other and embark on a blood-soaked bullet-riddled quest for cash and revenge. An unusual contemporary black-comedy western set in Australia, chock full of action and homage to the work of Sergio Leone.",90,A Bullet in the Arse,tt0389825
766,5.0,No tiene datos,Mac Alejandre,"RJ Nuevas, Mars Ravelo","Another adaptation of Mars Ravelo's colorful superhero. Captain Barbell has the human form of Enteng. One day Enteng received a mysterious barbell given by a hermit after he saved his life. Not knowing that the barbell can give Enteng's alter-ego Captain Barbell, a hero for the poor and mistreated. Also in the cast is Enteng's dream girl Cielo, an elementary-school mu... Leer todo",115,Captain Barbell,tt0389833
767,6.2,No tiene datos,Tony Y. Reyes,"Michael V.Tony Y. Reyes, Chito Francisco","Fredo, an assistant to scientist Prof. James Manalo, becomes the superhero Fantastic Man upon discovering an ancient orb and must battle against Diabolica, not knowing that she's his girlfriend who's possessed by an evil alien spirit",No tiene datos,Fantastic Man,tt0391147
768,No tiene datos,No tiene datos,Enrique Murillo,Enrique Murillo,No tiene argumento,90,El jardinero 2,tt0392182
769,3.0,No tiene datos,Ansar Kalabhavan,Ansar Kalabhavan,"Aji, who buys old buildings, demolishes them and sells the scrap, goes ahead to demolish a building for which his father had taken a contract. But he faces objection from the owner's daughter.",No tiene datos,Valathottu Thirinjal Nalamathe Veedu,tt0391516
770,4.6,No tiene datos,Enrique Murillo,Carlos Valdemar,No tiene argumento,90,El cara de chango,tt0391844
771,No tiene datos,No tiene datos,Miguel Ángel Rodríguez,"Armando Infante, Jay Mawhinney, Manuel Padilla",No tiene argumento,90,Dos gallos de Guanajuato,tt0391939
772,No tiene datos,No tiene datos,Enrique Murillo,Enrique Murillo,No tiene argumento,90,El perro malagradecido,tt0392602
773,No tiene datos,No tiene datos,Jorge Ortín,Fernando Zamora,No tiene argumento,90,La noche de los Troyanos,tt0392551
774,7.5,No tiene datos,Anthony L. Fletcher,Anthony L. Fletcher,"Set in the city of brotherly love, small time thugs and childhood friends begin a journey of redemption and regret. While working for crime underboss Frank Diablo, Vince and Paul question the life and death world they live in. Bobby on the other hand will do whatever it takes to succeed. As a test of loyalty, Frank gives Bobby a task that will change the three friends... Leer todo",85,Death by Association,tt0393198
775,6.1,No tiene datos,Ángel Sancho,Aurora Martínez,No tiene argumento,90,Y tu mamá... también es narca,tt0393984
776,No tiene datos,No tiene datos,Christian González,Christian González,No tiene argumento,90,Mi barrio cholo,tt0393473
777,6.4,No tiene datos,Jess Thomas,Jess Thomas,"Vladimir, a mysterious Russian, carrying a suitcase full of Al Qaeda money, arrives in Hollywood and forces a punky chick, at gunpoint, to write his life's story while being pursued on the roads of Southern California from Hollywood to the mountains.",83,Checking the Gate,tt0393148
778,No tiene datos,No tiene datos,Alejandro Todd,"Fernando Sáenz, Luis Gatica, Roberto Ballesteros","Luis, more often known as ""The Cat"", was obsessed with the careers of trucks, which is illegal. After having fulfilled a judgment of 10 years for having been the person in charge of an accident who involved the whole family, ""The Cat"" rushes forward again, kidnapping the wife of his rival, to provoke a bloody competition. -the plot, as given to me through the assistan... Leer todo",90,La troca perrona,tt0393899
779,No tiene datos,No tiene datos,Raymundo Calixto,"Raymundo Calixto, Amado Portillo",No tiene argumento,90,El valle de los gigantes,tt0393921
780,4.4,No tiene datos,A.K. Lohithadas,A.K. Lohithadas,"A lorry driver (Prithvi Raj) learns that gambling can bring big fortunes, as well as big losses in life.",No tiene datos,Chakram,tt0393139
781,No tiene datos,No tiene datos,Arturo Martínez hijo,"José Aguilera, Ivette Chiron, Odette Chiron",No tiene argumento,90,Los hijos del odio,tt0393355
782,4.4,No tiene datos,Wai-Man Yip,"Hing-Ka Chan, Man-Lung Ho, Ho-Leung Lau","(Cantonese with English subtitles) An advertising executive revamps a defunct martial arts tournament in order to use it in an advertising campaign for his current project. He also enlists the expert help of a young kung fu student who now lives in Japan. Sparks begin to fly between the two, until reality sets in: the ad exec already has a girlfriend, and they have a ... Leer todo",97,An Na yu wu lin,tt0395942
783,5.2,No tiene datos,Raymond To,Raymond To,No tiene argumento,73,Lao fu zi dong hua da dian ying: Fan dou shen tan,tt0396094
784,7.6,No tiene datos,Toshiya Shinohara,"Rumiko Takahashi, Katsuyuki Sumizawa",El Gran Demonio del Perro legó una de las Tres Espadas del Colmillo a cada uno de sus dos hijos. Ahora el poder maligno de la tercera espada ha sido despertado.,99,InuYasha: La espada conquistadora,tt0396659
785,4.6,No tiene datos,Miguel Ángel Lamata,"Miguel Ángel Lamata, Miguel Ángel Aijón","Two former Catholic school classmates want to be movie makers despite their total lack of talent, contacts, or even a story to tell.",99,Una de zombis,tt0396912
786,4.2,No tiene datos,Alice Wang,"Kenmochi Satoki, Imei Shu, Alice Wang","Four fearless and intrepid girls get selected by a recording company to undergo martial arts training in China to prepare themselves as a pop group. However, they are forced to disband one year later after their recording company goes under. Will these girls have the courage to stand up against all odds to fight for what they really believe in?",105,Kong shou dao shao nu zu,tt0398403
787,6.1,No tiene datos,Kazuyuki Izutsu,"Daisuke Habara, Kazuyuki Izutsu","A James Brown fanatic gangster decided to disband his own gang and see his long lost daughter before entering prison. Hoping to change his mind, his underlings planned to kidnap James Brown to convince him to perform privately for their boss.",112,Get Up!,tt0399087
788,5.2,No tiene datos,Pooja Bhatt,"Mahesh Bhatt, J.P. Dixit, Niranjan Iyengar",Kaya lives in a Buddhist village of Monks with her father who wants Kaya to devote her self to god and not live a normal like other females.The village head monk Lamha asks Kaya to travel to Delhi to bring a back a child named Llahmo who is believed to be re birth of their God.While in hotel Llahmo witness 's murder of a top cop where Kaya and Llahmo are asked by Insp... Leer todo,120,Paap,tt0399942
789,7.1,83,Ekachai Uekrongtham,Ekachai Uekrongtham,Biopic of transgender Muay Thai boxer Parinya Charoenphol who pursued the sport to pay for her gender reassignment surgery.,118,Beautiful Boxer,tt0401248
790,6.7,No tiene datos,Romy Suzara,"Romy Suzara, Joey T. Serrato, Raymond I. Imperio",No tiene argumento,115,Hiram,tt0403115
791,6.4,No tiene datos,Tanit Jitnukul,"Sumtum Boongua, Kome Kongkiat Komesiri, Mai Muangdum","A young swordsmith dreams of becoming a soldier, and his connections get him into the army. He falls for a lady of higher social status, and this provokes conflict with an ambitious sergeant.",125,Khunsuk,tt0404176
792,No tiene datos,No tiene datos,Francisco Javier López,Francisco Javier López,No tiene argumento,No tiene datos,La invitación a la pintata,tt0404144
793,No tiene datos,No tiene datos,Julio Aldama Jr.,Enrique Murillo,No tiene datos,No tiene datos,La guarecita de Michoacán,tt0404083
794,5.1,No tiene datos,Egor Konchalovskiy,"Daniil Koretskiy, Yuriy Perov, Viktor Shamirov","Colonel Fox is in charge of a counter terrorism group that will now have the complicated mission to help the police to prevent a dangerous Chechen terrorist organization that wants to free its leader at any cost, even if it has to destroy the whole place.",89,Antikiller 2: Antiterror,tt0405699
