,0,1,2,3,4,5,6,7
390,6.8,No tiene datos,C. Arunpandian,C. Arunpandian,"Devan is accused of murdering Jeeva, a photographer, as a video recording of the murder shows a man like him. When a CBI officer nabs Devan, he learns some bitter facts that makes him help Devan.",175,Devan,tt12465770
391,6.9,No tiene datos,Tsugumi Kitaura,"Keiichi Hasegawa, Hideyuki Kawakami",No tiene argumento,75,Urutoraman Kosumosu 2: The Blue Planet,tt1260515
392,6.4,No tiene datos,Milos Twilight,Victoria Guzman,"A group of terrorist taking over the Argentine Parliament, to avenge an old crime committed at the Falklands War.",119,Heroes del silencio,tt1263787
393,No tiene datos,No tiene datos,Krisztián Gábor Albert,Krisztián Gábor Albert,No tiene argumento,50,A muholdak árnyékában,tt12759182
394,No tiene datos,No tiene datos,No tiene datos,No tiene datos,No tiene argumento,No tiene datos,The FA Cup Third Round Cardiff City vs Leeds United,tt12787854
395,No tiene datos,No tiene datos,No tiene datos,No tiene datos,No tiene datos,No tiene datos,Jitsuroku shijo saidai no koso gizetsujo,tt12849024
396,No tiene datos,No tiene datos,No tiene datos,No tiene datos,No tiene datos,53,Ghetto Brawls,tt13265114
397,5.6,No tiene datos,Arjun Sarja,"Chinni Krishna, Arjun Sarja","Anjali falls in love with Ezhumalai, a dance master, unaware that he is a widower with a son. She is in for a shock when she learns that her father Nagalingam and Ezhumalai are sworn enemies.",160,Ezhumalai,tt1365457
398,7.9,No tiene datos,K. Mahesh Sukhadhare,"B.A. Madhu, V.S.N. Murti, Fanindra Rao","After apprehending a number of Jihadi terrorists in Kashmir, Subedar Surya returns home to his mother, Shanta; dad, Surendra; sister, Kaveri; and brother, Deva, who all live in village in Southern India. The entire family is aware that Surya is in love with his childhood sweetheart, Gauri, and arrange their engagement. After the engagement, Gauri father, Virendra, ask... Leer todo",150,Sainika,tt1395142
399,7.5,No tiene datos,Mohammad Mohsin,Bijaya Mishra,"Sudam Choudhury chooses to remarry for the sake of his only daughter Meenakshi (Rachana Benerji), After his marriage, he died. Meenakshi is now with her Step mother (Aparajita Mohanty) and Step-sister Manaswini. (Jyoti Misra). Meenakshi falls love with Dipankar (Siddhant Mahapatra), but her step mother wants Manaswini should marry Dipankar.",No tiene datos,Dharma Sahile Hela,tt1435488
400,6.7,No tiene datos,Rabi Kinagi,Purna Chandra DasRabi KinagiSubodh Pattanaik,No tiene datos,158,Sindura Nuhein Khela Ghara,tt1435590
401,7.0,No tiene datos,Sudhanshu Sahu,Manoj PandaRanjit Patnaik,No tiene datos,No tiene datos,Samay Kheluchhi Chaka Bhaunri,tt1435578
402,No tiene datos,No tiene datos,Alak Nath,"Alak Nath, Pankaj Jyoti Bhuyan",No tiene argumento,162,Eman Morom Kiyo Lage,tt14494568
403,5.6,No tiene datos,Charles B. Unger,Charles B. Unger,Mr. Lucke is about a young fashion photographer who is forced to choose between a high paying job and his desire for beautiful women.,80,Mr. Lucke,tt1483445
404,5.3,No tiene datos,Yeming Song,"Gehong Wang, Junfang Zhao","Set in 1999. Two China special force soldiers are selected to join in an international training camp located in Amazon basin in Latin America. They withstand plenty of tests and tremendous pressure, come successfully through the ordeal and win the honor.",102,Chong chu ya ma xun,tt1501292
405,No tiene datos,No tiene datos,Julio Aldama Jr.,Julio Aldama Jr.,No tiene datos,83,La Banda del Plebe,tt15225254
406,5.7,No tiene datos,Sumanth,"Sarath Babu, Brahmanandam, Vijayshanti",No tiene argumento,150,Sahas Baludu Vichitra Kothi,tt1575670
407,4.9,No tiene datos,Nukaarapu Suryaprakashrao,"Rajasekhar, Meena, Gajala","Raja dislikes his lookalike father and lives separately, but in spite of this, his father loves him. With time, Raja realises his mistakes and tries to make amends.",150,Bharatasimha Reddy,tt1579747
408,6.0,No tiene datos,V.V. Vinayak,"V.V. Vinayak, Paruchuri Venkateswara Rao, Gopalakrishna Paruchuri",The rivalry between a son and father who has their own principals of justice and revenge.,143,Chenna Kesava Reddy,tt1579748
409,No tiene datos,No tiene datos,N.V. Subbaraju,"Brahmanandam, Gopi Kiran, Prudhviraj","Vaishanavi's marriage is fixed with sub-inspector Subhash while her sister, Divaya's is fixed with his brother Avinash. However, on wedding day Divaya elopes with Narendra and gets married to him in a temple. But to her utter shock she soon discovers that Narendra is a don and she somehow manages to escape from him. Narendra is furious and sends henchmen to get Divaya... Leer todo",132,Lagna Pathrika,tt1575602
410,3.9,No tiene datos,Gopal B.,"Paruchuri Venkateswara Rao, Gopalakrishna Paruchuri","Ramu, a servant falls for beautiful daughter of his mistress, Chamundeswari, who is a business tycoon.",No tiene datos,Allari Ramudu,tt1583218
411,5.2,No tiene datos,G. Ram Prasad,"Chinni Krishna, Paruchuri Venkateswara Rao, Gopalakrishna Paruchuri","The movie starts with a fight in which Durga Prasad (Nandamuri Balakrishna) bashes up police for occupying a poor woman's house. Dhanunjaya Rao (Raghuvaran) comes to know of Durga's heroism and tells him his flashback. Dhanunjaya Rao and Chandra Sekhar (Charan Raj) are best friends. They each have a child. Dhanunjaya Rao is a business magnate, whereas Chandra Sekhar i... Leer todo",155,Seema Simham,tt1583363
412,No tiene datos,No tiene datos,Vikki,BrahmanandamRaasi,No tiene datos,No tiene datos,Police Sisters,tt1584726
413,7.0,No tiene datos,Puri Jagannadh,Puri Jagannadh,"Chanti who gets beaten up black and blue is rescued by a girl who takes care of him in the hospital, till he gets fine. He falls for this unknown girl. Will he ever find her and convey his feelings?",139,Idiot,tt1606248
414,7.1,No tiene datos,Sreenu Vaitla,"Sreenu Vaitla, Ramana Chintapally","Vamsy (Aryan Rajesh), Nandu (Namitha) and Bose (Rohit) are childhood friends. Vamsy and Nandu grew up very close. Bose falls in love with a beautiful girl named Sowmya. When Bose tells Vamsy about her, she deems it one more love affair that is bound to fail. Vamsy feels that friendship is more valuable than love and that love spoils a friendship.",144,Sontham,tt1612036
415,3.9,No tiene datos,Deepak,"Deepak, Viji","Bala, a hitman in Pasupathi's gang, is madly in love with Aarthi, the daughter of a rival gangster. Bala faces several problems when both the gangs plan to end their rivalry.",No tiene datos,Bala,tt1621768
416,3.8,No tiene datos,Douglas Kung,"Hui-Ying Chen, Yiu-Wang Ho",Hong Kong experiences a wave of macabre deaths: the victims have been sucked dry and steeped in snake venom. A young detective (Jackie Lui) follows a series of bizarre clues and scours the city's exotic underbelly to track down the killer. A nightclub (that doubles as a brothel) housing 5 seductive suspects appears to be at the centre of the mystery. The trail leads h... Leer todo,96,Fan sau ji do,tt1708505
417,6.4,No tiene datos,Teja,Mohan Nair,"A young couple falls in love but the woman's parents have already arranged her marriage with her wealthy cousin. Now, the couple must face the cousin's wrath to be united in love.",152,Jayam,tt1797416
418,4.2,No tiene datos,Makoto Kobayashi,"Yasushi Akimoto, Yasushi Hirano","Deep in the deserts of southwestern United States lies ""Neo Purgatory."" Formerly a nuclear waste disposal site, the facility has been turned into a prison for hardened criminals; that is, until the prisoners weaponize the nuclear waste and riot, turning Neo Purgatory into an international disaster. Maki Aoba, Doris Nicholas, Marilyn Moreau, and Naomi Jones make up the... Leer todo",100,6 Angels,tt1876229
419,No tiene datos,No tiene datos,Martijn Berndsen,Martijn BerndsenKlaas Lageveen,No tiene datos,50,Wereldkampioenschap Freestyle Roulette,tt1922786
420,No tiene datos,No tiene datos,Dave Haderlien,Dave HaderlienCory KufahlDan Urban,No tiene datos,60,Not Guilty,tt1990295
421,6.2,No tiene datos,Surinder Kapoor,Hemant BirjeDharmendraGoga Kapoor,No tiene datos,No tiene datos,Taqdeer Ka Sikander,tt2006247
422,7.4,No tiene datos,S. Kumar,"Hemant Birje, Dharmendra, Shakti Kapoor","This is a revenge story. Three criminals, Arjun, Kali and Shyam Singh, escape from prison and kill Karan Singh. At the time of their trial Karan gave witness against them. They also kill the judge. Judge's son Vijay, a police officer and Karan's daughter Reshma now try to take revenge.",82,Reshma Aur Sultaan,tt2006213
423,4.6,No tiene datos,Teerat Singh,"Dharmendra, Dinesh Hingoo, Anjali Kholapure","A story of Border Kashmir, where Pakistani's carry on terrorist activities at Line of Control. History is witness to the fact that when the terrorist attacked, the Indian's faced and gave them a combat reply, where all the people gave Qurbanis despite to their age and religion. Sir John is a Pakistani Agent sent to carry on terrorism at the Kashmir Border, he and his ... Leer todo",107,Border Kashmir,tt2006076
424,6.3,No tiene datos,Pasanta Bal,"Victor Banerjee, Sabyasachi Chakrabarty, Mithun Chakraborty",No tiene argumento,128,Hindustani Sipahi,tt2009491
425,3.1,No tiene datos,Gautam Verma,"Ishrat Ali, Mithun Chakraborty, Pinky Chinoy",A village in north east India is ruled by landlord Sagar. He exploits the Villagers. Govinda comes to rescue. Gautam step brother of Sagar visits village but he gets killed and Govinda takes his place .,119,Gautam Govinda,tt2009480
426,8.1,No tiene datos,Imran Khalid,Miraq Mirza,No tiene argumento,No tiene datos,Dushmani,tt2009466
427,5.9,No tiene datos,T.L.V. Prasad,"Archana, Mithun Chakraborty, Raza Murad",No tiene argumento,No tiene datos,Qaidi,tt2009559
428,3.6,No tiene datos,T.L.V. Prasad,Sheeba AgarwalDeepti BhatnagarMonica Castelino,No tiene datos,124,Meri Partigya,tt2009523
429,4.1,No tiene datos,Leela Prasad,"Sadashiv Amrapurkar, Ranjeet Bedi, Mithun Chakraborty","Watch the full movie, Mawali No. 1, only on Eros Now. Mawali No. 1 is a 2004 Indian Hindi film, directed by Leela V Prasad and produced by K C Bokadia. The film stars Mithun Chakraborty, Ranjeet and Sadashiv Amrapurkar in lead roles. The film had musical score by Anand-Milind.",115,Mawali No.1,tt2009521
430,No tiene datos,No tiene datos,Ping Kwong Lee,Wing-Tak Bo,No tiene argumento,78,Rìben Shaolin,tt2042580
431,No tiene datos,No tiene datos,Shinichi Nikaido,No tiene datos,No tiene datos,No tiene datos,Ai to rasetsu,tt2075090
432,No tiene datos,No tiene datos,Shinichi Nikaido,No tiene datos,No tiene datos,No tiene datos,Taiketsu! Kanfû vs Bokusâ,tt2075326
433,7.9,No tiene datos,Hajime Hashimoto,Koichi IiboshiIzuru Narushima,No tiene datos,No tiene datos,Shin jingi naki tatakai/Bousatsu,tt2098804
434,5.8,No tiene datos,Parthiban Radhakrishnan,Parthiban Radhakrishnan,"Jeevan wants to fight against the injustice in society. After losing his father to anti-social elements and knowing that he cannot fight alone, he approaches the cause differently.",No tiene datos,Ivan,tt2227574
435,5.7,No tiene datos,A. Venkatesh,Joseph Vijay,"Bhagvathi, a tea vendor, has big dreams for his younger brother, Guna. However, Guna gets killed by his girlfriend's father, who is unaware that his daughter is pregnant.",157,Bagavathi,tt2325539
436,No tiene datos,No tiene datos,Lung Kang,Law Au,No tiene argumento,83,Lie xue kuai che,tt2328840
437,No tiene datos,No tiene datos,Jimmy Ko,Chi-Ming Leung,No tiene argumento,No tiene datos,Huo xian sheng si lian,tt2334254
438,2.7,No tiene datos,K. Ravi Shankar,"Manek Bedi, Ranjeet Bedi, Mithun Chakraborty","Amar's family is destroyed at gunpoint by a gangster. Years later, Amar joins the police force with the sole intention of avenging the death of his family.",No tiene datos,Sabse Badhkar Hum,tt2437226
439,8.2,No tiene datos,Kimber Cox,Stephen Stenning,"Film following the events of the lively funny and fast moving play, features a young Dundee lad with an American girlfriend Obsessed with films, he sees his life as a series of movie-clips and his imagination takes him on a journey.",85,A Life More Ordinary,tt2445508
440,5.8,No tiene datos,Takeshi Miyasaka,Koichi Iiboshi,"Based on a novel ""The Battle Of The Yanagawa-Gumi"" by Koichi Iiboshi, it tells the story of criminal Jiro Yanagawa. Released from prison, Jiro the notorious Yoshimizu Yakuza family as a member. Not long after however, he sets out to form his own Yakuza clan in Osaka. This sparks a bloody territory war with the Devils Dragons.",178,Jitsuroku Yanagawa-gumi Jiro Yanagawa Densetsu - kanketsu,tt2459784
441,5.4,No tiene datos,Bhandit Rittakol,Bhandit Rittakol,"Set in early King Rama V era, former British soldier Peter Bain is busted for trying to sell defective firearms to influential Chinese merchant Yang. Forced to hunt wild game with these firearms along with Yang's men, Bain links up with ex-monk Wan and Karen-American hunter Julia, who he meets on the way to the jungle. The group sets off to hunt an elephant, said to b... Leer todo",98,Sab Suea,tt2581670
442,No tiene datos,No tiene datos,Ramesh U. Lakhiani,R.S. Pandit,Badal falls in love with a woman who agrees to marry him on a condition that leaves him in a life-shattering situation. What did she ask for?,145,Jeene Nahin Doongi,tt2579966
443,7.0,No tiene datos,Montazur Rahman Akbar,"Montazur Rahman Akbar, Monwar Hossain Dipjol",No tiene argumento,No tiene datos,Dhakaiya Mastan,tt2599808
444,No tiene datos,No tiene datos,No tiene datos,No tiene datos,No tiene datos,No tiene datos,No tiene datos,tt2606836
445,6.3,No tiene datos,Montazur Rahman Akbar,"Montazur Rahman Akbar, Abdullah Zahir Babu",No tiene argumento,No tiene datos,Major Saheb,tt2632098
446,5.6,No tiene datos,Montazur Rahman Akbar,Miju AhmedShahin AlamSuruj Bangali,No tiene datos,No tiene datos,Arman,tt2632010
447,5.0,No tiene datos,V. Menon,"Mahesh Anand, Aruna Irani, Kiran Kumar","Amrish Puri stars in and as ""Badmash no. 1"". Ranjeet Singh is a devil minded person who simply knows how to take unfair and undue advantage of any given situation, and therefore he is notorious for being ""Badmash no. 1"".",143,Badmaash No.1,tt2677146
448,No tiene datos,46,Dirk Collins,"Marc-Andre Bellieveau, Micah Black, Will Burks","THE PROPHECY takes a glimpse into the future of riding. The disciplines of big mountain and jib fuse together to begin the next major phase in the progression of riding. See the visionaries of the revolution step up and change the game. Jeremy Jones, Micah Black, and Kent Kreitler add freestyle to their big mountain repertoire. Unknowns Sage Cattabriga-Alosa and Marc ... Leer todo",63,The Prophecy,tt2728668
449,5.1,No tiene datos,Pratap Singh,Sukhdev Ahluwalia,"Arjun proposes to a fatherless girl named Kiran, and they are about to be married. It is at this moment that Kiran learns from her mother that her father is none other than Tarzan and that she has a sister, Aarti.",99,Tarzan Ki Beti,tt2728318
450,No tiene datos,No tiene datos,Babasaheb Powar,Babasaheb Powar,An army officer becomes an outlaw to save his sister.,154,Owalini,tt2815848
451,7.1,No tiene datos,D. Rajendra Babu,"D. Rajendra Babu, Chandra Barkur, Kaviraj","A murderer, wants an honest peaceful life, go to law college to complete his graduation.",125,Nandhi,tt2924844
452,No tiene datos,No tiene datos,Rajendra R. Gupta,Rajendra R. Gupta,No tiene argumento,No tiene datos,Kaun Karega Insaaf,tt2953592
453,7.4,No tiene datos,M.S. Ramesh,"Kaviraj, V. Nagendra Prasad, R. Rajashekhar","When Varada learns that his rival has killed his sister, he decides to avenge her death.",139,Dhumm,tt2957912
454,No tiene datos,No tiene datos,Christopher Miller,Christopher Miller,No tiene datos,No tiene datos,The Director's Cut,tt3078848
455,7.0,No tiene datos,Montazur Rahman Akbar,Abdullah Zahir Babu,No tiene argumento,No tiene datos,Bhoyanok Songghorso,tt3099800
456,No tiene datos,No tiene datos,Konstantin Nguen,"Mikhail Ayzentir, Louis Per Bruno, Vyacheslav Kulakov",The stories of a group of martial arts fighters come to life during an international tournament.,No tiene datos,Vremya varvarov,tt3111712
457,No tiene datos,No tiene datos,Y. Nageswara Rao,Y. Nageswara Rao,No tiene datos,No tiene datos,Raghava,tt3414008
458,6.8,No tiene datos,P. Vasu,P. Vasu,No tiene datos,No tiene datos,Prudhvi Narayana,tt3415580
459,No tiene datos,No tiene datos,Frankie Chan,Frankie ChanHuaiyang Qiu,No tiene datos,No tiene datos,Jue zhan Zh Ka Ge,tt3732022
460,No tiene datos,No tiene datos,Aurora Martínez,"Jorge Reynoso, Raúl Araiza, Bruno Rey Jr.",No tiene argumento,91,"Entre narcos, mota y polvo",tt3774340
461,No tiene datos,No tiene datos,Harinam Singh,Harinam Singh,No tiene datos,No tiene datos,Basanti Ki Shaadi Honeymoon Gabbar Ka,tt3914306
462,No tiene datos,No tiene datos,No tiene datos,No tiene datos,No tiene datos,No tiene datos,Auraton Ka Jail,tt3916610
463,7.9,No tiene datos,Kishan Shah,Anand Dehelvi,Tara Singh is a true patriot and lives in a village with his father Mukhiya Ram Prasad Singh and mother. Thakur Baldev's Singh daughter Chaya loves Tara. Ram Prasad raises his voice against Thakur Baldev. Baldev soon finds out that Chaya loves Tara and swears to destroy him and his family. Tara is is accused of being a terrorist by Baldev Singh in cahoots with the Ins... Leer todo,120,Return Of Gadar - Ek Desh Premi,tt3914774
464,3.6,No tiene datos,Kanti Shah,Bashir Babar,An innocent and meek girl who has never seen the world outside of the village dreams to seeing the city. She wants to explore the world outside of the village but sadly her dreams are crushed when she gets abducted by the lusty Thakur. He rapes her and leaves her to die on the streets. The humiliation and violence that she goes through transforms her completely and sh... Leer todo,No tiene datos,Shola Bai,tt3914346
465,6.0,43,Georgio,"Georgio, Jeremy Gray, B. Scott O'Malley","Georgio (who also wrote and directed the film) stars as Tony Wheeler a up-and-coming music producer looking for his big break, and will stop at nothing from getting it which leads into him clashing with a ruthless music mogul.",95,Tapped Out,tt0250023
466,7.1,No tiene datos,Rakesh Roshan,Rakesh Roshan,"A developmentally disabled young man tries to continue the work his father did in communicating with extra-terrestrials from outer space, which leads to something miraculous and wonderful.",171,Koi... Mil Gaya,tt0254481
467,6.1,No tiene datos,Clark Johnson,Robert Hamner,"Un capo de la droga encarcelado ofrece una enorme recompensa en metálico a quien pueda liberarlo de la custodia policial, y solo el equipo de armas y tácticas especiales de la policía de Los Ángeles puede impedirlo.",117,S.W.A.T.: Los hombres de Harrelson,tt0257076
468,5.2,No tiene datos,Jalal Merhi,Glen G. Doyle,Two rival gangs battle for territory.,91,Héroe ocasional,tt0256400
469,4.5,No tiene datos,David McNally,Steve Bing,"Dos buenos amigos, Charlie Carbone (Jerry O'Connell) y Louis Fucci (Anthony Anderson) se esfuerzan para progresar en la vida, pero sus métodos no podrían ser más distintos.",89,"Canguro Jack, trinca y brinca",tt0257568
470,3.4,No tiene datos,Walter von Huene,"Tray Mc, Knight, Walter von Huene, Michael Hartson",Special Forces Captain Aldo Paccione must pull together his former world team Delta Force and go deep within the mines of Sardinia when it is discovered that a vengeful band of mercenaries are developing deadly biochemical weapons.,99,Ancient Warriors,tt0264365
471,6.4,No tiene datos,John McTiernan,James Vanderbilt,Un agente de la DEA investiga la desaparición de un legendario sargento instructor de los Rangers del ejército y de varios de sus cadetes durante un ejercicio de entrenamiento que salió terriblemente mal.,98,Basic,tt0264395
472,8.2,No tiene datos,Quentin Tarantino,Quentin Tarantino,"Tras despertar de un coma de cuatro años, una antigua asesina se venga del equipo de asesinos que la traicionó.",111,Kill Bill: Volumen 1,tt0266697
473,6.0,No tiene datos,F. Gary Gray,Christian Gudegast,Un hombre conocido como Diablo surge para dirigir un cártel de la droga después de que el anterior líder sea encarcelado.,109,Diablo (A Man Apart),tt0266465
474,6.1,No tiene datos,William Friedkin,David Griffiths,Un rastreador del FBI intenta capturar a un asesino entrenado que ha hecho de la caza de humanos un deporte.,94,The Hunted (La presa),tt0269347
475,6.7,No tiene datos,Juan Carlos Buitron,Juan Carlos Buitron,A young man trades his hopes and dreams to save his brother from a life of drug-dealing and gang activity.,84,Everyday,tt0270349
476,5.6,No tiene datos,Dennis Dugan,Jay Scherick,Dos guardias de seguridad que no coinciden se juntan para detener una operación de contrabando.,88,Seguridad nacional,tt0271668
477,6.6,31,Vincente Stasolla,Vincente Stasolla,The Forgotten tells the story of an American Corporal's last days while left to command his isolated front line tank unit during the Korean War.,No tiene datos,The Forgotten,tt0272092
478,6.2,33,Peter Howitt,Neal Purvis,"Tras un repentino ataque al MI5, Johnny English, el espía más seguro de sí mismo, aunque poco inteligente, se convierte en el único espía de Gran Bretaña.",89,Johnny English,tt0274166
479,4.2,No tiene datos,Tony Markes,"Pamela Chais, Diana Levitt, Douglas K. Stuart","When a young woman (Lanza) is swindled by a handsome con (Rowe), veteran detective Phil Hannafin (Murray) manages a group of misfit trainees in a race to find him.",85,Getting Hal,tt0274523
480,5.4,85,Pol Cruchten,"Frank Feitler, Randall Fontana, Pol Cruchten",Three runaway teenagers run for the hills. What begins as a Huck Fin and Tom Sawyer story quickly turns into a relentless hunt through the forests driving three teenagers to the limits of their physical and mental endurance.,97,Boys on the Run,tt0275979
481,6.4,No tiene datos,Gregor Jordan,"Robert Drewe, John Michael Mc, Donagh",Un hombre inocente se convierte en uno de los criminales más buscados que el mundo haya conocido.,110,Ned Kelly (Comienza la leyenda),tt0277941
482,2.5,No tiene datos,Yossi Wein,Michael D. Weiss,"Cuando la novia de un líder de una secta intenta dejar el rebaño, encuentra que escapar es más difícil de lo que imaginaba.",90,Devastación,tt0281811
483,5.6,No tiene datos,Ang Lee,Stan Lee,"Bruce Banner, un investigador de genética con un pasado trágico, sufre un accidente que le hace transformarse en un monstruo verde furioso cuando se enfada.",138,Hulk,tt0286716
484,3.9,No tiene datos,Ana Clavell,Jason Rainwater,Sophia is a street fighter who is going to show the boys in East L.A. what it means to fight as a girl.,88,Chick Street Fighter,tt0285475
485,5.3,No tiene datos,Mark Steven Johnson,Mark Steven Johnson,"Un hombre cegado por unos residuos tóxicos, que también han potenciado el resto de sus sentidos, lucha contra el crimen como un acrobático superhéroe de las artes marciales.",103,Daredevil,tt0287978
486,6.3,No tiene datos,Robert Rodriguez,Robert Rodriguez,"El Mariachi, un asesino a sueldo, se ve envuelto en una trama internacional de espionaje que envuelve a un psicótico agente de la CIA y a un general mexicano corrupto.",102,El mexicano,tt0285823
487,5.2,No tiene datos,Gordon Chan,Alfred Cheung,Un detective sufre un accidente fatal que involucra un medallón misterioso el cual lo transforma en un guerrero inmortal con poderes sobrehumanos.,88,El poder del talismán,tt0288045
488,7.4,No tiene datos,Bryan Singer,Zak Penn,"Cuando el coronel antimutantes William Stryker secuestra al Profesor X y ataca su escuela, los X-Men deben aliarse con su archienemigo Magneto para detenerlo.",134,X-Men 2,tt0290334
489,2.6,85,Mark Cross,Mark Cross,Eight college students being chased through the desert by a road raging maniac.,87,The Trip,tt0293961
490,6.6,No tiene datos,Roger Donaldson,Roger Towne,Su mentor le pide a un joven y brillante aprendiz de la CIA que le ayude a encontrar a un topo en la agencia.,115,La prueba,tt0292506
491,No tiene datos,No tiene datos,Stephen Chang,Joël Tibbits,"Two parallel stories dealing with dark matter. On Earth, a scientist struggling with writing the definitive paper on the scientific concept fails to notice more obvious issues in his personal life. In an alternate space and time, a mythological being called The Guardian is charged with manipulating and protecting dark matter. He must fend off beings that seek to gain ... Leer todo",No tiene datos,Noctivagant,tt0293461
492,3.4,36,Leslie Libman,"Timothy Scott Bogart, James Hereth",Un equipo secreto de rescate de Black Ops formado por atletas de deportes extremos de la Generación X viaja a Nueva Zelanda para salvar a un ex miembro que ha sido secuestrado.,78,The Extreme Team,tt0295249
493,5.8,51,Gérard Krawczyk,Luc Besson,"Para detener a una nueva banda disfrazada de Santa Claus, Emilien y Daniel deben lidiar también con cambios importantes en sus relaciones personales.",90,Taxi 3,tt0295721
494,3.5,No tiene datos,Joseph Zito,"BJ Davis, Adrian Fulle, Brent Huff","A reporter attempts to figure out why there has been an energy crisis in the United States. Complicating matters are a series of aftershocks from a powerful earthquake, strangers firing weapons at him, and the disappearance of some workers attempting to investigate businesses who have harmed the environment.",100,Power Play,tt0295529
495,5.5,No tiene datos,Jon Amiel,Cooper Layne,La única manera de salvar a la Tierra de la catástrofe es perforar hasta el núcleo y ponerlo a girar de nuevo.,135,El núcleo,tt0298814
496,5.6,No tiene datos,Richard Donner,Michael Crichton,Un grupo de arqueólogos queda atrapado en el pasado intentando recuperar a un amigo. El grupo debe sobrevivir en la Francia del siglo XIV antes de poder volver al siglo XXI.,116,Timeline,tt0300556
497,4.2,22,David De Bartolome,Brad Mirman,"En un mundo asolado por la enfermedad, él es la única cura y la última esperanza para la humanidad.",96,Absolon,tt0300902
